t͡ʃ æ p l ə t	chaplet
ɹ iː s t ɹ ɛ n θ ə n	restrengthen
s ɝ s i s	surcease
ɛ k w ɪ p ɔ ɪ z	equipoise
b ɛ n t͡ʃ	bentsh
t ɔ ɹ s o ʊ	torso
s ə b v ɜ ɹ ʃ ə n ɛ ɹ i	subversionary
ɹ ɪ l e ɪ t	relate
m ə t͡ʃ ʊ ə ɹ ə t i	maturity
l ɛ m e	lemme
p ɜː ɹ s p ɪ k e ɪ ʃ ə s	perspicacious
m ɛ t ə n ɪ m ɪ k	metonymic
æ l m ə n d	almond
p a ɪ k ə	pika
t ɹ æ k t a ɪ l	tractile
æ d ə n a ɪ i	Adonai
t a ʊ p o ʊ	Taupo
s t ɹ ɪ p ɪ t	strippet
k ɹ ɪ m s ə n	crimson
n u m ə ɹ ə n ɪ m	numeronym
t u t ɪ l ɛ ɹ ɪ k	tutelaric
h ɝ m ɪ t	hermit
d ɪ s d͡ʒ ɔ ɪ n t	disjoint
p ʌ n z	puns
b ɑ ɹ d i	bardie
d a ʊ n l o ʊ d ɪ ŋ	downloading
ʃ iː d	she'd
ɡ æ ð ɚ	gather
p ɑː n t ə s	Pontus
ɹ æ f t ə ɹ	rafter
p ɑ s t͡ʃ ə ɹ ə l	postural
p iː l ɪ ŋ z	peelings
s a ɪ n z	sines
t͡ʃ ɝ t͡ʃ ɪ k ə l	churchical
m ɪ s ɛ n	mesen
ɹ i ɑ l p o ʊ l ɪ t i k	realpolitik
d j uː t o ʊ s ə ɹ iː b ɹ ə l	deutocerebral
ʃ o ʊ b ɪ z	showbiz
t ɪ t͡ʃ ə l ɚ	titular
l ɪ l͡s p	lisp
ɛ l z	els
æ b z k w ɑ t͡ʃ ʊ l e ɪ ʃ n̩	absquatulation
b ɪ t ɹ e ɪ ə l	betrayal
t ɹ uː ɪ d͡ʒ	truage
ɡ ɹ ɪ z l i	grisly
l æ n d l ʌ b ɚ	landlubber
ə s j uː m d	assumed
s m ɪ d ʒ	smidge
ɛ m p a ɪ ɹ iː n̩	empyrean
s ə l u b ɹ i ə s	salubrious
s ʌ b d j ʊ ɹ ə l	subdural
ɡ ɒ s ə m ə ɹ i	gossamery
a ɪ m ə	Imma
t͡ʃ ɔ ɹ	chore
b ɛ l j u a ɪ n	belluine
uː d ə ʊ	udo
ɑː ɹ k ɪ v ɪ s t	archivist
b l ʌ f ɚ	bluffer
b ɔ l z i	ballsy
p ə h o ʊ i h o ʊ i	pahoehoe
n e ɪ t ə l	natal
s æ l m ə d i	psalmody
æ m a ɪ d	amide
m a ɪ n t s	Mainz
s ə b ɜː ɹ b i ə n	suburbian
ɪ l j u s ɪ v	elusive
t ɛ ɹ ə n s	Terence
b e ɪ s ə n	basin
p ɝ b l a ɪ n d	purblind
s k ɒ t͡ʃ m ə n	Scotchman
ə s t ɑː ɹ t	astart
w iː d ɪ ŋ	weeding
k ə l o ʊ n	Cologne
s t ə k ɑː t o ʊ	staccato
p æ ɹ ə	para
b æ l i b ʌ n i ə n	Ballybunion
ɑː t͡ʃ uː	achoo
m ɪ s i	Missy
e ɪ v ə n d e ɪ l	Avondale
s uː d	sued
k ɹ o ʊ n i	crony
j u b ɪ k w ɪ t ə s	ubiquitous
k ɒ ɹ ə l ə ɹ i	corollary
æ l t ɪ m ɪ t ɚ	altimeter
t ɑ d	Tod
θ j uː z	thews
z ɪ ɹ	xyr
ɡ e ɪ l	Gayle
l uː iː z i æ n ə	Louisiana
j ʊ ə ɹ o ʊ p i ə m	europium
p ɹ ɪ k ɜː ɹ s ɪ v	precursive
f ɪ n d ɹ ɪ n i	findrinny
s k w iː k s	squeaks
æ f ɹ o ʊ d	afroed
s ʌ b t ə l	subtile
h o ʊ θ	Howth
æ n ɪ k d o ʊ t	anecdote
k ɹ ɪ n ɪ t	crinet
v ɪ ɹ iː	viri
ɡ æ l v ə n ɑ m ə t ɚ	galvanometer
f ʌ ŋ k ʃ ə n z	functions
ɹ ɪ ɡ ɹ iː d i ə n s	regredience
s ʌ p l ə m ə n t	supplement
k ɔː t ə ɹ a ɪ z e ɪ ʃ ə n	cauterization
k l a ɪ m æ t ɪ k l i	climatically
d͡ʒ æ p ə n iː z	Japanese
æ k t iː ə n	Actaeon
z ɪ l ɒ f ɪ h æ d	Zelophehad
j ʊ ə ɹ ə ʊ s ɪ s	urosis
v ə l ʌ p t͡ʃ ʊ ɛ ɹ i	voluptuary
k ɹ ɪ t ɪ k ə l i	critically
ɹ ʌ ʃ	rush
d ɪ k h ɛ d	dickhead
s o ʊ l	soul
ʃ ɛ n d	shend
ɪ n ɹ o ʊ d	inroad
t o ʊ k ɑ k ɹ ə s i	ptochocracy
d ɪ m iː n	demesne
ə d͡ʒ ʌ s t ɪ d	adjusted
d e ɪ n d͡ʒ ɚ z	dangers
b ɛ k w i	Bequia
ʌ n ɹ iː z ə n ə b l̩	unreasonable
s æ f a ɪ̯ ɚ	sapphire
æ n ə l ɔ ɡ	analog
t͡ʃ æ p l ɪ d ɨ d	chapleted
ɪ ɹ ɪ t e ɪ ʃ ə n	irritation
f l æ p	flap
b ɜ ɹ ɡ ɹ e ɪ v	burgrave
m æ l ɪ k	malic
ɛ s k ə p e ɪ d	escapade
t o ʊ b l ə ɹ o ʊ n	Toblerone
b æ m b uː i	bambooey
ɡ l iː n z	gleans
m ɑ d	mod
l ɒ d͡ʒ e ɪ	logge
ɹ æ k ə ɹ	racker
f ɪ ɡ j ə ɹ e ɪ ʃ ə n	figuration
k ə m p l a ɪ ə n t	compliant
m ɛ t ɹ o ʊ n ɪ m	metronym
n ɪ m f ə l ɛ p s i	nympholepsy
p ɑ s t ɚ n	postern
s ɪ ɹ ə ɫ a ɪ z	Cyrillize
v æ s ə l ɪ d͡ʒ	vassalage
ɒ p	op
s ə l a ɪ v ə s	salivous
ə d͡ʒ iː n ɔː	Agenor
m a ɪ ə l ɪ n	myelin
b ə s u t ə ʊ l æ n d	Basutoland
l ɪ ŋ ɡ w ɑ l ɪ s	lingualis
s a ɪ z ə b ə l	sizable
æ l uː	aloo
b l o ʊ ɪ ŋ	blowing
k ɑ m ə l ɪ ʃ ə n	commolition
s l ɛ d	sled
b æ b ɪ l ɒ n ɪ k	Babylonic
ɡ ʌ n a ɪ t	gunite
d æ n a ɪ t	Danite
p ʌ b l ɪ s a ɪ z	publicise
ð ɚ	their
n o ʊ ʃ ə n z	notions
ɡ ʌ b ɪ n d͡ʒ	gubinge
p o ʊ s t p r ə s iː d͡ʒ ə r	postprocedure
k ɑ n v ɪ k t	convict
d ʌ l s ɪ n iː ə	Dulcinea
k ɹ uː d l i	crudely
d ʌ n s	dunce
s ə s ɪ ŋ k t	succinct
ɪ n t ɹ æ n s ə d͡ʒ ə n t	intransigent
ɹ iː ə f ɛ n d ə ɹ	reoffender
l æ ɹ ɪ ŋ k s	larynx
m i æ n d ɚ	meander
k ɪ l d	killed
f æ ɡ s ə n t	fagcent
d ɪ n d	dinned
ɛ k s ə k ɹ e ɪ ʃ ə n	execration
ɪ n t j uː ɪ t ɪ v n ə s	intuitiveness
k ə l æ b ɹ iː ə	Calabria
k ɒ n k j ə b ɪ n ɛ ə ɹ i ə n	concubinarian
k ɹ æ m p i	crampy
n ɪ m b ə s	nimbus
s ə m b ɹ ɛ ɹ o ʊ	sombrero
p ɹ iː m iː ə m	premium
h ə m ʌ ŋ k j ə l ə s	homunculus
k ɔ ŋ ɡ o ʊ	Congo
m ə n ɑ t n i	monotony
v æ d ʒ ɪ n ɒ m ɪ t ə ɹ	vaginometer
s ɔ m ə l j ɛ ɹ	sommelière
ʃ i ɹ d	sheared
s ɪ n ɪ ə ɹ i ə s	cinereous
w a ɪ v	wive
z iː k	Zeek
ɛ l ɪ m ə n t s	elements
f æ s n ɚ	fastener
ɛ m f ɪ z i m ə	emphysema
l ʌ l	lull
l ɪ p ɪ d	lipid
m ɑ n i m ə l i m n i ə n	monimolimnion
d ɔː k	dawk
ʃ ə m ɑː n	shaman
p ə ɡ æ n ɪ k	paganic
f iː m e ɪ l i ə	femalia
ʌ n p ɒ s ɪ b ə l	unpossible
æ s ɪ t ɒ k s ə l ə ʊ n	acetoxolone
ɹ ɛ f j uː s	refuse
d ɔ ɹ l i f	doorleaf
b o ʊ b ɛ ʃ	bobèche
t e ɪ p ɪ ə ɹ	tapir
h ə w a ɪ j ə n	Hawaiian
ɡ ɹ o ʊ s ə ɹ i	grocery
d͡ʒ ɝ z i	jersey
ə n æ s t ə m o ʊ z	anastomose
n ɔ p l i ə s	nauplius
æ b s ɜː d ə	absurda
ɪ d i ə ʊ s ɪ ŋ k ɹ æ t ɪ k	idiosyncratic
d ɔː l i	Dawley
z ɛ p ə l ɪ n	Zeppelin
f ɝ n æ n d o ʊ	Fernando
ʃ æ ŋ ʃ ʌ ŋ	xiangsheng
p ɹ ɑ d͡ʒ ɪ k t	project
d ɪ ʃ ə l	appendiceal
k ə ɹ ɪ s m ə s	Kiritimati
p ɹ a ɪ m ə ɹ i	primary
ɪ n b ɑ k s	inbox
t w e ɪ n	twain
h uː t s	hoots
z ɑ ɡ ɹ ɛ b i ə n	Zagrebian
t ɹ æ n z d͡ʒ ɛ n d ə ɹ d	transgendered
ə ɡ ɹ a ʊ n d	aground
m j ɑ n m ɑ ɹ	Myanmar
s k ɪ l f ə l	skilful
h a ɪ p o ʊ l ɛ m ə	hypolemma
k ɚ k u b ɹ i	Kirkcudbright
æ b d͡ʒ ʊ ɹ	abjure
f ɛ l t ə ɹ	felter
h iː z ə n t	he'sn't
f ɹ i h o ʊ l e ɪ s	frijoles
ɛ θ n ə ʊ ɹ ɪ l ɪ d͡ʒ ə s	ethnoreligious
t ɹ a ɪ m ɛ θ ɪ l æ s ɪ t e ɪ t	trimethylacetate
v æ ɡ ə b ɑ n d	vagabond
ɪ ɹ ɛ l ə v ə n t	irrelevant
p ə ɹ oː ɡ i	pierogi
ʃ ɛ ɹ ə l	Cheryl
ɡ ʊ l b ɛ ŋ k i ə n	Gulbenkian
t ɹ æ n s l e ɪ t ɪ d	translated
k ɑ n l æ ŋ	conlang
d ə b j uː	debut
b æ n ɪ ʃ ɪ z	banishes
t ɪ ɹ ɪ ŋ	tearing
s uː z ə	Susa
n ʌ k	NUC
k u l i	coulee
d ɪ s t ɪ l ə t	distillate
æ p l ɪ k e ɪ ɚ	appliquer
d a ɪ ə t ɪ t ɪ ʃ ə n	dietetician
h ɛ ɹ o ʊ ɪ z ə m	heroism
s t u p ɪ d ɪ t i	stupidity
ɹ ɪ b ə ʊ d ɪ k ɪ n z	ribauldequins
d ɹ a ɪ ɚ	dryer
æ l b ə s e ɪ t e ɪ	Albacete
p ɛ n ɪ ŋ z	pennings
ɡ ɹ iː n z p ɒ n d	Greenspond
j ɑ h ə ɹ	Yahir
w ɔ ʃ a ʊ t	washout
l æ f a ɪ ɛ t	lafayette
h ɛ ɹ ɪ d ɪ t ə m ə n t	hereditament
s n iː t͡ʃ	Sneetch
s l e ɪ	slay
w a ɪ ə m ɪ s ɪ ŋ	Wyomissing
n æ t	gnat
f o ʊ̯ n ə l ɑ d͡ʒ ɪ k ə l	phonological
k ɑ z m ɑ ɡ ə n i	cosmogony
k ə m b æ t ɪ v	combative
ɡ æ ŋ ɪ ŋ	ganging
z o ʊ t ə ɹ o ʊ l ɪ m ə s	zotarolimus
s t æ t l ɚ	Statler
ɹ ɪ v j uː	revue
k e ɪ b	CAIB
ɛ m p a ʊ ə ɹ	empower
f ɑː l k ə n	falcon
k ɛ ɹ ə ɡ i n	carrageen
f iː l i	feely
ʃ ɪː	shii
s u b ə	tsuba
s æ f ɹ ə n	saffron
n ɛ k ɪ d	nekkid
ʃ m uː z	schmooze
z u n ɑ t ɪ k	zoonotic
ʌ n l o ʊ d	unload
k l æ v ɪ k j ə l ɚ	clavicular
p iː t	peet
j ɛ s ɪ z	yeses
m ɛ ɹ i	mere
l æ n d f o ʊ k	landfolk
f l iː m	fleam
w ɛ t ɚ	whetter
d͡ʒ ʌ d	Judd
ɪ m p e ɪ l ɪ ŋ	impaling
p ɚ p l ɛ k s t	perplexed
p j uː t ɹ ə f æ k ʃ ə n	putrefaction
m ʌ l t i k ʌ l t͡ʃ ə ɹ ə l	multicultural
m ɑ ɹ ʃ ə l	Martial
p æ s k	pasque
ɒ s t ə n t e ɪ ʃ ə s	ostentatious
s æ l o ʊ w ɪ ʃ	sallowish
k l ʌ m	clumb
w e ɪ w ə ɹ d n ə s	waywardness
k ʌ l ə ɹ ə t	colorate
d͡ʒ ɛ m ɪ n iː	Gemini
ɡ l ə t ɒ ɡ ə n i	glottogony
ɡ ɹ o ʊ s b iː k	grosbeak
p ɜ ɹ s ə n	person
e ɪ b i s i d æ ɹ i ə	abecedaria
s ɒ ŋ s t ɚ	songster
s ʌ m b ʌ d i	somebody
t ɪ ə ɹ d	teared
ə p ɪ n i e ɪ t	opiniate
ɒ m n ɪ d ɪ ɹ ɛ k ʃ ə n ə l	omnidirectional
ɹ a ʊ n d ə ɹ z	rounders
m a ʊ z ə l	Mousehole
s k ɹ ə f iː t o ʊ	sgraffito
d ɛ k ɑː ɹ k	decarch
b i	be
f ɔ ɪ l ɪ ŋ z	foilings
æ s p ɛ k t	aspect
m ɝ s ə n ɛ ɹ i	mercenary
ɪ n t ɹ uː ʒ ə n	intrusion
p ɛ n ɪ t ɛ n ʃ ə l	penitential
h ɪ p i ɪ ʃ	hippyish
s a ɪ b ə ɹ	cyber
ʌ p s ɪ l ɑ n	upsilon
l ɛ ə ɹ i	lairy
ɪ n t ɹ ə n t	intrant
k ə n ɔː r ə	Kenora
ɹ ɛ t ɹ o ʊ	retro
ɹ ɪ n a ɪ	reny
ʃ a ɪ n d	shined
f l iː m i	fleamy
s ɛ v ə ɹ ə ɹ	severer
æ l p ɹ æ z ə l æ m	alprazolam
ɹ ɛ t ɹ ə f l ɛ k s	retroflex
s ɚ m a ʊ n t	surmount
t e ɪ s t i	tasty
s ʌ ɹ ə p t ɪ ʃ ə s	surreptitious
f a ɪ n a ɪ t	finite
s æ n ɪ t ɛ ə ɹ i ə m	sanitarium
l iː v a ɪ	Levi
b ɑ m	balm
ʌ f ɪ ʃ	uffish
d͡ʒ i ə m ɛ t ɹ ɪ k ə l	geometrical
ɪ d i ɑ k ɹ ə s i	idiocracy
s u p ɚ b i ɪ ŋ	superbeing
d ɹ o ʊ v d	droved
k æ m ə ɹ ə n	Cameron
ɹ i ɪ n æ k t	reenact
ɡ l æ s t ə n b ə ɹ i	Glastonbury
k ə m p iː t ɪ ŋ	competing
b ɹ e ɪ ʒ ə ɹ	brazier
ɹ ɒ m	Rom
ɡ ɹ e ɪ θ	graith
s t e ɪ b ə l	stable
s ɪ ɡ n ɪ f a ɪ ə n s	signifiance
m e ɪ n t ə n ə n s	maintenance
k æ p	cap
ʍ ɪ t b i	Whitby
o ʊ n ə b l̩	ownable
l ʌ m b ɚ	lumber
k w ɔ ɹ t ə ɹ ɑː ɹ o ʊ	Quartararo
f ɑ l o ʊ	follow
o ʊ l d i	oldie
s ə p a ɪ t	sopite
d ɝ p	derp
d͡ʒ uː n z	Junes
ɡ ɹ ə s i n i	grissini
s ə s p ɛ n d ɪ d	suspended
d ɛ v z	devs
m ɒ d ə ɹ e ɪ t ə ɹ	moderator
ɛ n v ə l o ʊ p	envelope
t͡ʃ ɪ z ɪ k	Chiswick
s k i d u	Skidoo
t ʃ ɪ t ʃ	Chich
s ə ɹ ɛ p t ɪ ʃ ə n	surreptition
d͡ʒ iː l	geal
æ b d ɑ m ɪ n o ʊ h ɪ s t ɚ ɹ ɑ t ə m i	abdominohysterotomy
ɪ k s t ɹ iː m ə	extrema
s u p i	soupy
k ə l ɪ ɡ ɹ ə f i	calligraphy
d͡ʒ æ p	Jap
k ɪ n d ə ɹ ɡ ɑː ɹ d ə n	kindergarten
t s ɑ n	Zhan
ə l i v i e ɪ t	alleviate
h ɑː n ə k ə	Hanukkah
k w ɪ n t ɪ l j ə n	quintillion
æ t ɑː ɹ	attar
p j ɚ	pure
l a ɪ m ə ɹ	limer
t ɹ æ p ə z ɔ ɪ d	trapezoid
ɑ p ə z ɪ t	opposite
ɪ d i ə s ɪ ŋ k ɹ ə s i	idiosyncrasy
s t ə t ɪ s t ɪ k	statistic
ɹ ɛ m ə ɹ ə	remora
p ɹ ɒ k t ə d iː ə m	proctodeum
ɡ ʌ n z	guns
æ b d ʌ k t o ɹ i z	abductores
ɛ k s p o ʊ z	expose
k ɔ ɪ n e ɪ	koine
i k ə n ɑ m ɪ k	economic
b a ʊ t	bout
m ɛ θ ɪ l t ɹ a ɪ iː n ə l o ʊ n	methyltrienolone
d ɪ t ɛ k ʃ ə n	detection
k w e ɪ s a ɪ	quasi
ə b l a ɪ d͡ʒ ɪ ŋ	obliging
ɹ æ m p ɑː ɹ t	rampart
ɡ ɹ e ɪ p s	grapes
n ɛ t ɪ z ə n ɹ i	netizenry
æ k t i ə m	Actium
æ ɹ ə b ɪ k	Arabic
k o ʊ f ɛ f iː	cofeoffee
k ɹ ə ʃ ɛ n d o ʊ	crescendo
t͡ʃ ɑ ɹ l i n	Charlyne
ə n ʌ l	Anal
v æ s t ə t i	vastity
n uː b i	newbie
k w ɑ s i ə	quassia
l æ m ɪ n ə	laminar
d ə m iː t ə ɹ	Demeter
t͡ʃ w iː	Twi
p ə t ɑː k ə	pataca
d o ʊ l ə s	dolus
m ɜː ɹ d	merd
ə p ɑ m	appam
ɹ ɛ d ə l ə n s	redolence
s ɪ m t i	SMPTE
z æ l s ɪ t ə b i n	zalcitabine
d a ɪ ə z ɑ k s a ɪ d	diazoxide
t ɪ ŋ k t͡ʃ ɚ	tincture
ɹ æ d l̩ d	raddled
s p i s i e ɪ ʃ ə n	speciation
l e ɪ t ɛ k	LaTeX
ə ɡ ɹ ɑː n ə m ɪ s t	agronomist
p ɛ z ə n t ɹ i	peasantry
l o ʊ l ə	Lola
k ɹ ɪ n ə l ɪ n	crinoline
ə b s t i m i ə s l i	abstemiously
b uː ɹ o ʊ s	Borås
d͡ʒ o ʊ n	Joanne
l ɪ ɡ m ə	ligma
b æ m b i n o ʊ	bambino
s ʌ l ɪ v ə n	Sullivan
æ l p a ɪ n	Alpine
ɡ ɑ t n̩	gotten
h ɑ ɹ k ɪ b ʌ s	harquebus
æ k ə ɹ ɔ ɪ d	acaroid
ɪ ɡ n ə ɹ ə n t	ignorant
æ k ə d i m j ə	academia
k ɪ s t v a ɪ n	kistvaen
m ɑ ɹ t i n ə	Martina
s t ɪ ŋ	sting
ə b ɪ s o ʊ b ɜ n t θ ɪ k	abyssobenthic
p ɛ n t s ə l	pencil
h ɛ l ə n ə	Helena
æ ŋ ɡ l ə s f ɪ ɹ	Anglosphere
k l ɪ k ɪ ŋ	clicking
ɪ p s w ɪ t͡ʃ	Ipswich
m ə l o ʊ m i z	melomys
æ l k ə h ɒ l ə d ʒ i	alcohology
ə θ ɔ ɹ ə t ɑː	authoritah
m ɔː ɹ b i ə n	Morbihan
b ə l ɛ t ɪ k	balletic
k ə b uː l	Kabul
t͡ʃ ɛ k ə	chequer
h a ɪ d ɹ ə f ə ʊ b ɪ k	hydrophobic
k ɪ l ɪ m ə n d͡ʒ ɑː ɹ ə ʊ	Kilimanjaro
h ə f t ɔː ɹ ə	Haftarah
ɡ ɹ i v z	Greaves
ɪ ɡ z uː b ə ɹ ə n t	exuberant
s ɝ k j ʊ l e ɪ ʃ ə n	circulation
d o ʊ b j uː t ə m iː n	dobutamine
h ɪ s t ə ɹ i ɒ n ə m ə ɹ	historionomer
p ʌ n d͡ʒ ə n t	pungent
l iː ə n	Leon
k ɑ m b ɪ n e ɪ ʃ ə n z	combinations
ɪ n t ɚ n æ ʃ ə n æ l	Internationale
ɔ i l ɑ k ɹ ə s i	oilocracy
m æ ɡ n ə n ɪ m ɪ t i	magnanimity
h ʌ n d ə ʊ	hundo
f ɹ ɪ d͡ʒ ɪ d	frigid
t ɛ n d ɪ ŋ	tending
s æ l j u t e ɪ ʃ ə n	salutation
k ɑ ɡ ə j ɑ n	Cagayan
k ə m p ɹ a ɪ z d	comprised
f e ɪ n t	faint
ɹ ɪ z ɪ s t ɪ d	resisted
k ə n f j uː ʒ ə n	confusion
p ɔ ɪ z ə n b ɛ ɹ i	poisonberry
ʍ i l h a ʊ s	wheelhouse
ɡ ɔ d i	gaudy
d ʌ l ə h æ n	Dullaghan
f o ʊ l d͡ʒ ə r	Folger
ɹ u p ə ʊ f ə ʊ b i k	rupophobic
ə s i ɹ i ɪ n	Assyrian
s ɔː ɹ d s m ɪ θ	swordsmith
ɡ uː f t	goofed
ɹ o ʊ t n̩	Rhoten
θ o ʊ w ə l	thowel
f ɹ ɛ ʃ m ə n	freshman
ð e ɪ	they
m ɛ n s t ɹ u ə l	menstrual
j ɛ l	yell
v a ɪ n z	vines
ð	th'
h o ʊ l i	wholly
ɡ l ə ʊ z ə ɹ	glozer
k l a ɪ ə n t ɛ l	clientèle
ɒ l ɪ ɡ ə ʊ s iː m ɪ k	oligosemic
b ɜː ɹ ɡ ʌ n d ɪ ə n	Burgundian
ɪ ɹ ɪ t ɹ e ɪ ə	Eritrea
ɪ m p æ ɹ ɪ s ɪ l æ b ɪ k	imparisyllabic
ʃ æ m b ɔː d	Chambord
ɪ n f l ɪ k t ɪ d	inflicted
k ə ɹ ɑ t s ɪ n	karozzin
f ɹ a ʊ z i	frowzy
k ɹ a ɪ̯	krai
ɪ n ə p ɹ o ʊ p ɹ i ə t	inappropriate
k ə ʊ b l ɛ s	cobless
t ɛ n d ɛ n ʃ ə s	tendentious
ɛ k w a ɪ n	equine
f ɔ ɹ θ ɔ t f ʊ l	forethoughtful
h o ʊ w ə ɹ θ	Howarth
s p ʌ d͡ʒ ɚ	spudger
w ɑ ɹ ə n t i	warranty
p ʊ ʃ t͡ʃ ɛ ə ɹ	pushchair
p ɹ o ʊ b ɛ n ə s ɪ d	probenecid
ɹ i o ʊ	Rio
f l ɒ k s ɪ n ɔː s ɪ n a ɪ h ɪ l ɪ p ɪ l ɪ f ɪ k e ɪ ʃ ə s	floccinaucinihilipilificatious
ɪ m b ɛ l ɪ ʃ m ə n t	embellishment
s l ɪ p ɪ f n i	sleepiphany
t iː	T
m ɛ ɹ ɪ t o ʊ ɹ i ə s	meritorious
m ɪ s s ɪ ɡ n ə l	missignal
b ɜː ɹ ɡ o ʊ	Burgo
d ɑː ɹ ʊ m ə	daruma
t͡ʃ ɪ ɹ ə p	chirrup
æ ɹ ə n d ə	Arrernte
l ɔ n d ɚ	launder
ɡ æ n	GaN
n j ʊ r o ʊ ə n æ t ə m i	neuroanatomy
k ɛ l i	Kelly
n j u z	news
ɪ n s t ɪ t u ʃ ə n ə l i	institutionally
ɪ v æ n ə v ɪ t͡ʃ	Ivanovich
l uː t iː ʃ ə n	Lutetian
ʍ ɔː ɹ t ə n	Wharton
k ɛ t s ɑ l	quetzal
ə n iː m ɪ k	anemic
f j u n æ m b j ə l e ɪ t	funambulate
ʌ m b ɹ ɪ f ə ɹ ə s l i	umbriferously
j ʊ ɹ iː θ ɹ ə l	urethral
ə b ɛ d͡ʒ	abegge
z a ʊ ɚ s w ɑ p t	zowerswopped
t w æ ɡ	TWAG
e ɪ̯ ɛ f	af
j u f o ʊ̯	UFO
h o ɹ d ɚ	hoarder
ɪ z ə b ɛ l ɪ n	isabelline
k ə n ʌ k	Canuck
ɑː ɹ k e ɪ a ɪ z	archaize
m ə m e ɪ l i ə n	mammalian
t͡ʃ ɛ s ə l	chessil
ɪ ɹ ɪ z ɪ s t ə b ə l	irresistible
k uː p ɪ ŋ	cooping
s ə s t e ɪ n ə b l i	sustainably
d e ɪ ɪ s t s	deists
v ɪ k t o ʊ ɹ i ɑ n ə	Victoriana
f ɛ ɹ ɚ	farer
d i n o ʊ	Dino
b l ɑː n t͡ʃ	blanch
iː	æ
d iː m a ɪ ɡ ɹ e ɪ t	demigrate
d ɪ k i	dicky
l ʌ s t ɚ l ə s	lusterless
æ l k ə m ɪ s t s	alchemists
j ɑː m ə t ə ʊ	Yamato
t ɹ ɛ f	tref
ɹ iː p ɹ ə d ʌ k ʃ ə n	reproduction
n ɛ s t ɪ ŋ	nesting
k ɹ æ k s	cracks
m æ l v ə z i ə	malvasia
d ɒ l ɪ k ə ʊ f æ l ɪ k	dolichophallic
t͡s ɑ ŋ t͡s o ʊ	Zhangzhou
ɛ k s f iː t e ɪ ʃ ə n	exfetation
s t æ m ɪ n ə l	staminal
ɔ ɹ i o ʊ l	aureole
ə ɹ a ɪ t	aright
h ɔ ɹ d	hoard
m ɪ s t ɹ ə ʊ	mistrow
ə b ɛ t s	abets
ɹ æ k u n	raccoon
d ʌ n ə ɹ t	dunnart
s p ɑː d	spaad
d z ʊ ŋ ɡ ɛ ə ɹ i ə	Dzungaria
b ə l iː f	belief
f l æ p ɪ ŋ z	flappings
ɛ s k ɑ ɹ ɡ o ʊ	escargot
n iː ɒ ɡ ɹ ə f i	neography
p ɑ n d ɚ ə s	ponderous
ɔ ɪ	oe
b ɑ ɹ ɛ n	Baren
p ɹ i t͡ʃ ɚ	preacher
b ɹ uː z ɪ ŋ	bruising
f ɪ k s ɪ d n ə s	fixedness
j uː v ə	uva
s æ l k ə t o ʊ n ɪ n	salcatonin
f æ ʃ ə n	fashion
d͡ʒ u d iː ə n	Judean
ɡ ɹ æ n d p ɛ ə ɹ ə n t	grandparent
v ɔ ɪ s ɪ ŋ	voicing
ɹ ɑ n d ə	Rhonda
f ɑ ɹ m z	farms
ɪ n s ʊ l ə	insula
k æ p ə	cappa
m ɑ ɹ t n̩	Martin
æ l d ʒ ɪ n e ɪ t	alginate
ɑ ɹ k ə t ɛ k t ɑ n ɪ k	architectonic
b ɪ ɡ æ n	began
h ɛ f ə l ʌ m p	heffalump
p ɚ s ɛ n t a ɪ l	percentile
l ʌ m b r ə k e ɪ l ɪ s	lumbricalis
ɡ ə l ɪ ʃ ə n	Galician
θ iː ɪ n ɪ z ə m	theinism
d͡ʒ ɑ ŋ j ɪ n	Jiangyin
s t ɛ ɪ ʃ ə n d	stationed
s l ɒ b	slob
ɝ θ s k ɹ e ɪ p ɚ	earthscraper
d͡ʒ æ b ɪ ŋ	jabbing
f ɚ ɡ ɪ v n ə s	forgiveness
s ɛ t iː	settee
f o ʊ n o ʊ t æ k t ɪ k s	phonotactics
s iː s t	ceased
ɪ n t ɚ æ k ʃ ə n	interaction
ɛ m b l ə m	emblem
k ɑ ŋ ɡ r ə ɡ e ɪ ʃ ə n ə l ɪ s t ɪ k	congregationalistic
n æ s t i	nasty
b æ l ə n s	balance
ɛ f ɪ ŋ	effing
s ɝ ʃ ə	Saoirse
p j uː z	pews
j uː d͡ʒ	yuge
ð iː	the
ə m ɒ k	amok
ɹ æ m b ə l	ramble
p ə ʊ s t p ɑː ɹ t ə m	postpartum
ɪ n t ɛ n ʃ ə n	intension
ə p ɪ n d ɪ k s	appendix
k ə m p æ ɹ ɪ s ə n	comparison
h o ʊ m o ʊ	homo
k ɪ ɹ i z	Keres
k o ʊ w ɝ k ɚ	coworker
æ ŋ ɡ l ə f ɪ l ɪ k	Anglophilic
m æ r ə n a ɪ t	Maronite
b ə ɹ iː d	bourride
ɑ p o ʊ	oppo
ɔ ɹ ɪ̈ n d͡ʒ	orange
p l e ɪ s t e ɪ ʃ ə n	PlayStation
k w ɑ ʃ	quash
b ɹ ɪ t͡ʃ ɪ ŋ	breeching
k ə ɹ o ʊ ʒ ə n	corrosion
ɪ n t ɚ m i d i ɛ ɹ i	intermediary
ɹ ɪ n ɪ ɡ	renege
k w ɒ d ɹ ɑ v a ɪ d͡ʒ ɛ s ɪ m ə l	quadravigesimal
b ɑ m	bomb
f ə n iː m ɪ s a ɪ z	phonemicize
d j ʌ v	d'y'ave
m ə z uː m ə	mazuma
b ɪ ɡ i	biggy
f ɪ ə ɹ m ʌ ŋ ɡ ə ɹ	fearmonger
k ɑː ɹ b o ʊ h a ɪ d ɹ e ɪ t	carbohydrate
ɡ uː t͡ʃ iː n	guqin
s l ɛ d ə	sledder
m iː b ɜː r n	Meaburn
ɹ a ɪ n d	rind
d͡ʒ ɨ n o ʊ m	genome
s ə ɹ æ n d ə	Sarandë
d æ ʃ b o ə ɹ d	dashboard
f o ʊ t ɪ l	fauteuil
p l ɛ n t i ə s	plenteous
ɛ s ə t ɛ ɹ ɪ k	esoteric
m ɝ l ə n	merlon
t͡ʃ ɪ ɹ ɪ ŋ	cheering
t ə ɹ e ɪ n	terrain
t ɔ k ɪ ŋ	talking
s ɛ t l̩ ɚ	settlor
ɛ ə ɹ ə m	arum
p ʌ ʃ t ə ʊ	Pashto
p e ɪ n f ə l	painful
m ɛ ʒ ɚ d	measured
s k ɹ iː n	screen
k ə n d o ʊ l	condole
n o ʊ m	Nome
ɪ n s p ɚ e ɪ ʃ ə n	inspiration
m ɑ ɹ k s	marks
b ɛ ɹ i ɚ	barrier
p ɑ l m	palm
t ɹ ə p æ n	trapan
t͡ʃ a ɪ v	chive
ɡ ɪ b n ʌ t	gibnut
ɡ ə z ɛ l ʃ a f t	Gesellschaft
k ə r æ t ə k ə s	Caratacus
m o ʊ ɡ ə l	mogul
p ʌ ŋ k ə w ɑ l ə	punkahwallah
l ɑ ɡ l æ ŋ	loglang
f l ʌ k t͡ʃ uː e ɪ ʃ ə n	fluctuation
t͡ʃ æ v z	chavs
d͡ʒ ə b ɹ o ʊ n i	jabroni
z ɑ ɹ p	Zarp
m e ɪ l ə	malar
v æ s ɪ l e ɪ ʃ ə n	vacillation
ɑ ɹ m ə t o ʊ l	armatole
j uː ʒ	yewzh
p ɹ a ɪ s	price
d ɛ n e ɪ	Dene
d uː f ɚ	doofer
l ɝ n	learn
m ɑ ʒ ɑ ŋ	mahjong
n ɪ t p ɪ k	nitpick
a ɪ l iː n	Eileen
z a ɪ l ə ʊ m æ n s i	xylomancy
n o ʊ k h ɪ k	nokehike
ɪ n t ə ɹ e ɪ d͡ʒ ə n s i	interagency
p ʌ f t	puffed
ɪ p ɪ f n i	Epiphany
p a ɪ ɹ ə l ɔ ɪ d	pyraloid
d ʌ k s	dux
s iː z ə n ə l	seasonal
k ɒ k w ɒ f ə l	cockwaffle
æ l a ɪ z	Allies
k r æ p t	crapped
ɛ f ɚ t l ə s l i	effortlessly
b iː t͡ʃ n ʌ t	beechnut
ɡ ɑ d z	gods
ʌ n ɔ ɪ j ɪ ŋ l i	annoyingly
f ɔ ɪ l d	foiled
k w ɔ ɹ i	quarry
ɪ m p l ɪ s ɪ t	implicit
w ɑ s p ɪ ʃ	waspish
p ɑ p j ə l ɚ	popular
ɹ uː l	rule
ɛ m z	Ms
h ɑ k	hough
d͡ʒ ɛ ŋ k ɪ n	Jenkin
j ɔ ɹ	yore
s m uː d͡ʒ	smoodge
w ɛ d ə d	wedded
s p ɛ k j ə l ɚ	specular
n uː p iː d i ə	Nupedia
ə t æ k s	attacks
iː s t ɪ v e ɪ ʃ ə n	aestivation
ɡ ɹ ɪ m d ɑː ɹ k	grimdark
ɹ ɪ f j uː z d	refused
e ɪ k ɔ d e ɪ t	acaudate
s e ɪ n j o ʊ ɹ	señor
s æ ʃ e ɪ d	sacheted
p o ʊ s t p r ə s iː d͡ʒ ə r ə l	postprocedural
ɹ ɛ t ɹ ə f l ɛ k t ə ɹ	retroflector
i d i e ɪ ɡ ə s	aedeagus
ɛ m j ə l e ɪ t ə ɹ	emulator
p i ə n ɡ w ɑ n	Pianguan
æ d m a ɪ ɚ ɹ ɚ	admirer
ɹ ə d͡ʒ ɛ k ʃ ə n	rejection
k ɑ n v ɛ n t	convent
p ə t ɹ o ʊ l i ə m	petroleum
d͡ʒ e ɪ v	jave
d ɪ s v ɑː n t e ɪ d͡ʒ ə s	disvantageous
ɪ n d ɝ ɪ b ə l	endurable
ɡ l ɛ n z	glens
m ɝ s ɚ	Mercer
v æ l i ə m	Valium
l ə m j uː ɹ i ə	Lemuria
b l uː z ɔ̃ː	blouson
æ b d j u s ə s	abduces
l o ʊ l l i t ə	lolita
ɪ v ɛ n t j u æ l ɪ t i	eventuality
ʌ l s ɚ ə s	ulcerous
n ɪ n d͡ʒ ə	ninja
t͡ʃ æ ŋ t͡ʃ æ ŋ	Chengcheng
b ə s ɚ k	berserk
w ɪ t	whit
b a ɪ b ə l	bible
l ə d	lad
ɪ n d ɛ k s	index
ə m iː b ɪ k	amoebic
d i a ɪ s ɚ	deicer
k w ɒ d r ɪ v e ɪ l ə n t	quadrivalent
k ə n s t ɪ t͡ʃ u ə n s i	constituency
æ n ɪ k d o ʊ t s	anecdotes
z o ʊ ə	zoa
k iː n o ʊ t	keynote
f j uː t͡ʃ ə ɹ ɪ z ə m	futurism
ɛ ɹ i ə	area
p e ɪ l ɪ s t	paylist
s ɪ l i ɛ ɹ i	ciliary
t ɹ u d i	Trudy
d͡ʒ æ k i	jacky
ə v æ s t	avast
ə b j uː s ɪ d͡ʒ	abusage
m æ ɡ n æ n ɪ m ə s	magnanimous
m ɑ n t ɑ ʒ i s t	montagist
s w i t	sweet
ɪ n d o ʊ̯ t͡ʃ a ɪ̯ n ə	Indochina
h æ l ɪ f æ k s	Halifax
d͡ʒ ɛ ɹ i	Jerrie
k ɔ ɹ ə n e ɪ ʃ ə n	coronation
ɪ ɡ z æ d͡ʒ ə ɹ e ɪ ʃ ə n	exaggeration
j uː t ə ɹ a ɪ	uteri
s o ʊ l	Sol
s t æ n ə ɹ i	stannary
k ə n f l e ɪ ʃ ə n	conflation
i k o ʊ t ʊ ɹ ɪ z ə m	ecotourism
ə b z ɔ ɹ b ɪ d l i	absorbedly
s p a ɪ r o ʊ k i t ɒ l ɪ s ɪ s	spirochetolysis
ɑ ɹ ɛ s ɛ f ɛ s ɑ ɹ	RSFSR
s æ n d i	Sandie
t ɪ t ɪ v ɪ l	titivil
w ʌ t	wut
f ɪ l ɪ ŋ	filling
s ə b l ə k s e ɪ t	subluxate
ɹ ʊ k i	rookie
ɡ ʊ d l ə s	goodless
b ɪ ə ɹ ʃ iː b ə	Beersheba
w ɪ v ə ɹ n	wyvern
m ʊ s k ə d e ɪ	muscadet
t e ɪ m z	tames
ɡ ʌ v ə ɹ n ə ɹ ə t	governorate
v ɪ l e ɪ n	villein
p l æ n ə m o ʊ s	planemos
b l æ k b ɚ d	blackbird
ɪ ɡ w ɑ n ə	iguana
p ʌ b l ɪ ʃ ɪ ŋ	publishing
s ə ɹ ɪ n d͡ʒ	syringe
p ɑ l	Poll
n i o ʊ v ə d͡ʒ a ɪ n ə	neovagina
n æ ʃ ɪ z	gnashes
k ɹ ɛ s t ɪ ŋ	cresting
p ɹ ə z ʌ m p t͡ʃ u ə s	presumptuous
æ ɡ b ɑ d ə	agbada
d͡ʒ ɔː i	jawy
l a ɪ v s t ɑ k	livestock
ɒ n ɪ k ə ʊ m a ɪ k ə ʊ s ɪ s	onychomycosis
æ ɹ ɪ s	arris
æ p ɹ ɪ s a ɪ t ə b i n	apricitabine
m ɪ l ɒ d ɪ k	melodic
æ s ɚ t e ɪ n d	ascertained
iː v æ n d͡ʒ ɛ l ɪ k	evangelic
s ɪ s k	CISC
ɛ k s p ɹ ɛ ʃ ə n ə l	expressional
f ɪ n ɪ ʃ t	finished
f e ɪ z ɚ	phaser
ə k æ n θ o ʊ s ɛ f ə l ɪ d	acanthocephalid
t ə b uː l i	tabbouleh
s ʌ b s ɪ d i	subsidy
h æ ŋ ɡ z a ɪ ə t i	hangxiety
ɹ e ɪ n	rain
k ɔ ɹ s ɪ z	courses
ɪ n ɒ s k j ʊ l e ɪ t	inosculate
h æ k z o ʊ ɹ	haxor
b ə k ə ʊ n ɪ ə n	Baconian
j ɑː n j ɪ n ə	Janjina
ɪ n t ɑ ɡ l i o ʊ	intaglio
b ɹ ɪ ŋ z	brings
t æ ŋ d	tanged
b ɪ t p l e ɪ n	bitplane
ɪ n t ɹ ə v a ɪ t l̩	intravital
l ɔː n s t ə n	Launceston
p ɒ n t ə p ɹ iː ð	Pontypridd
p i t ɹ a ɪ n	Petrine
ə k æ m p s i ə	acampsia
w i l b æ ɹ o ʊ	wheelbarrow
ɪ k s t ɛ m p ə ɹ i	extempore
s ʌ m ə t	summit
ɛ v ə ɹ ɪ t	Everett
s t ɹ e ɪ t ə n ɚ	straightener
d iː ɛ m z ɛ d	DMZ
k e b ɹ ɑː d ə	quebrada
e ɪ b a ɪ ɑ t ɪ k	abiotic
d ɛ d f ɑ l	deadfall
k ɑ n d͡ʒ ə ɡ e ɪ t	conjugate
h ʌ ʃ t	hushed
p r o ʊ t ɪ s t	protist
ɹ ɪ m uː v ɚ	remover
ə ɹ e ɪ n z	arraigns
ɪ n t ə ɹ ə s t	interest
k o ʊ l b ɛ ɚ	Colbert
h a ɪ p ə ɹ t ə p ɒ l ə d͡ʒ i	hypertopology
k ɑ ŋ k j ə b a ɪ n	concubine
s æ k j ə l a ɪ	sacculi
d iː s ɪ n k ɹ ə n a ɪ z e ɪ ʃ ə n	desynchronization
æ t ə ʃ e	attache
p ɪ n o ʊ k i o ʊ	Pinocchio
w ɪ n d͡ʒ d	winged
s t ɹ e ɪ̯ n d	strained
k æ d h ɪ ə ɹ ɪ n	cadherin
æ l f ɹ iː k	Ælfric
p ə θ ɛ t ɪ k	pathetic
p ə d ɛ s t ɹ i ə s	pedestrious
f l u t ə m a ɪ d	flutamide
f l ɪ n d ə	flinder
k a ɪ l ə	Kyla
b ɔ ɪ l ɪ ŋ	boiling
a ʊ t p ʊ t ɪ ŋ	outputting
ɹ ʌ t i	rutty
p ɒ l ɪ θ iː ɪ z ə m	polytheism
s t e ɪ k h o ʊ l d ɚ	stakeholder
l ɑː t k ə	latke
f ʌ l m ɪ n e ɪ t	fulminate
d ɪ s ɛ n ʃ ə n	descension
a ʊ t l a ɪ n	outline
ʃ e ɪ o ʊ l	Sheol
b ɪ s ɛ t	beset
ɪ n æ n t i ɔː ɹ n ɪ θ a ɪ n	enantiornithine
k æ p s t ə n	capstan
e ɪ k l ɛ ə ɹ s iː s m ɒ̃ n	eclaircissement
n ɑ s t ɪ k	Gnostic
s ʌ n z	suns
h ʌ ɡ ə b l ɪ	huggably
t ɔ ŋ ɑ n	Tong'an
d͡ʒ ɑ b s t ɚ	jobster
ə l ɛ θ ɪ k	alethic
m ɔ d ə l	maudle
ɡ ɔ ɹ d͡ʒ ə ɹ ɛ t	gorgerette
a ɪ s o ʊ k ɑ ɹ b ɑ k s ə z ɪ d	isocarboxazid
b ɛ θ s e ɪ ɪ ɾ ə	Bethsaida
t͡ʃ ɔ ɪ s ɪ z	choices
θ e ɪ l iː n	phthalein
k ə n s t ɪ t͡ʃ u t ɪ v	constitutive
l ɛ s ə n	lesson
m ɚ ɡ w i	Mergui
k æ m f ɚ	camphor
p ɹ ɑ k j ə ɹ e ɪ t ɚ	procurator
ɡ ɪ m b ə l	gimble
m æ d l i	madly
ɔ θ ɔ ɹ ə t ɛ ɹ i ə n	authoritarian
ə k ɑ m p l ɪ ʃ m ə n t s	accomplishments
æ n ɪ s i d	aniseed
p l æ t ɪ p ʊ s	platypus
f iː n ə k ɪ s t ə s k ə ʊ p	phenakistoscope
l o ʊ f ɚ	loafer
b ɪ l ɔ ŋ z	belongs
s ɛ n t ɹ ə s a ɪ t	centrocyte
k æ n b ə ɹ ə	Canberra
p ʊ s i h w ɪ p	pussywhip
k o ʊ l æ b	collab
ɪ k s p ɛ n d ɪ t͡ʃ ɚ	expenditure
m e ɪ t͡ʃ i	maechi
s l o ʊ v æ k i ə	Slovakia
d ɑ k j ə m ɝ ʃ ə l	documercial
æ n s ə ɹ ɚ	answerer
æ m n ɪ s t i	amnesty
ʃ ɑ t ɡ ʌ n	shotgun
iː v n ɪ ŋ	evening
b æ k ɹ ɛ d	backread
m æ ɡ ə z iː n z	magazines
h ɛ l p t	helped
s t ɑː ʒ i ɛ ə ɹ	stagiaire
ɡ l æ d ɪ o ʊ l ə s	gladiolus
t æ b	tab
s ɚ d͡ʒ ɛ k t ɪ v	surjective
t ʌ f t ɪ d	tufted
h ɔː l s k ɒ t	Harlescott
ɛ n i ə s t a ɪ l	enneastyle
