b ɹ æ k i θ ɛ r ə p i	brachytherapy
f a ʊ l z	fowls
t ʃ æ t ə ɹ b ɒ k s	chatterbox
f ɪ l ɪ b ɛ ɡ	philibeg
ʍ ʊ p s	whoops
d͡ʒ i n j ə s	genius
p i p iː l	Pipil
æ p l ɪ k ə b ə l	applicable
j o ʊ k s	yolks
s ʌ s p ɛ k t	suspect
ɪ k s p ɛ k t ɪ ŋ	expecting
e ɪ k æ p n i l̩	acapnial
k iː ɛ f	Kiev
ɹ u m	room
ɹ ɛ f ɹ ə ɡ ə b ə l	refragable
ɔː d	aud
s k w ɪ l ɪ t ɪ k	squillitic
ʃ o ʊ ɫ d ɚ	shoulder
ə n a ʊ n t s	announce
s ɛ f t æ z ɪ d iː m	ceftazidime
m æ n ə d͡ʒ ə b ə l	manageable
d ɪ s k ɝ ɪ d͡ʒ	discourage
uː p s	oops
s n ɪ f ə l	sniffle
v ə l ɛ n s i ɛ n	Valenciennes
b ɜː ɹ n a ʊ t	burnout
d ɪ k e ɪ z	decays
p ɹ æ t i k	pratique
t͡ʃ ɑ n	CHON
t ɜː ɹ w ɪ t	Tyrwhitt
ɹ uː m ɚ	rumour
k æ p ɪ t ə l a ɪ z e ɪ ʃ ə n	capitalization
v ɪ k t ɔː ɹ i ə	Victoria
z a ɪ ɡ ə m æ t ə k ə s	zygomaticus
d ɪ v ɜː ɹ t ɪ z m ə n t	divertisement
ɪ n t ɚ ʃ ɛ l	intershell
k ə n s ɛ n t	consent
ɪ n f l ɪ k s ɪ m æ b	infliximab
d͡ʒ ɔ ɪ	joy
d ɪ s ɪ n f ɹ æ n t͡ʃ a ɪ z	disenfranchise
s ɛ s k w ə p ə d e ɪ l i ə n ɪ z m̩	sesquipedalianism
ɪ n f ɪ l t ɹ e ɪ t	infiltrate
s ɛ ɡ m ə n t	segment
s j u z ə ɹ ə n t i	suzerainty
h ɒ s p ɪ t ə l a ɪ z	hospitalize
b ɑ ɹ o ʊ ɚ	borrower
t͡ʃ ɪ z ə l	chisel
t ɛ k n o ʊ k æ p ɪ t ə l ɪ s t	technocapitalist
i b ɑ n ɪ k s	ebonics
m iː k l i	meekly
s l ɛ p ɪ f ə n i	sleepiphany
t ɑː ɹ p ə l ɪ n	tarpaulin
ɒ m b ɔː ʒ w a z m ɑ̃	embourgeoisement
k æ n ə b ə l ɪ s t ɪ k	cannibalistic
f ə l ə ʊ n i ə n	phelonion
ɹ ɛ p ə ɹ e ɪ t	reparate
d e ɪ ə s a ɪ d	deicide
k ɝ s t n ɪ s ɪ z	cursednesses
l iː v ə ɹ	livre
w ʊ t ʃ ɪ t s k i	Wojcicki
ɹ iː t ɛ ə ɹ	retear
æ b ə k ɑ s t	abacost
h æ v ɪ k	havoc
ɑː ɹ t ɪ s t ɪ k l i	artistically
p a ɪ z	pies
ɡ l ɛ n k ə ʊ	Glencoe
b ɪ k ɛ n	beken
æ ʃ t ɹ e ɪ	ashtray
m j u z i ə m	museum
k ɹ ɒ n	chron
m ɪ s t ɪ s ɪ z ə m̩	mysticism
s w ɪ ð ə	swither
ɡ l u k ə ɡ ɑ n	glucagon
t e ɪ t ɚ	tater
ʊ m ə	ummah
p ɹ ɑ z ə l ɪ t a ɪ z	proselytize
z u ə n ɑ t ɪ k	zoonotic
k l ɔ ɹ æ z ə p e ɪ t	clorazepate
s k æ t ɚ d	scattered
s n ɛ ɚ z	snares
p ə ɹ m j uː t	permute
h ə z b æ n d ə ʊ	husbando
ɑ k ə b ɑ	Aqaba
t ɛ t r a k l ɔː r ə ʊ ɛ θ ɪ l iː n	tetrachloroethylene
æ ŋ ɡ ə l	Angle
v ɝ s ə t ə l l i	versatilely
b ɑ ɹ b ə ɹ ə	Barbara
n uː d͡ʒ i æ ŋ	Nujiang
t͡ʃ ɑ d ɹ ə n	chawdron
h ɑː ɹ t b ə ɹ n	Hartburn
s l iː v iː n	sleiveen
l ɔ ɹ ɪ k	lauric
l e ɪ d ɚ h o ʊ z ə n	lederhosen
p æ l ɪ i o ʊ l ɪ θ ɪ k	Paleolithic
m ɪ d i v ə l	medieval
s ɪ m ɪ ɹ i ə n	Cimmerian
s ə s p ɛ k t	suspect
ɑ ɹ k ɪ t ɹ e ɪ v	architrave
s uː n ɑː m i	sunami
f e ɪ t i ɑ l e ɪ s	fetiales
ɹ ɪ m a ɪ n d	remind
æ n t ʌ m b ɹ ə	antumbra
d ɪ s j uː z d	disused
ʃ a ɪ d	shide
æ n t i s ɛ p t ɪ k	antiseptic
t ɛ t ɹ ə s a ɪ k l iː n	tetracycline
k æ l ɪ f æ k ʃ ə n	calefaction
m ɑ n t ə l uː k æ s t	montelukast
t e ɪ m s a ɪ d	Tameside
ɹ o ʊ v ɚ	rover
ɹ iː d͡ʒ uː v ə n e ɪ t	rejuvenate
l ɪ m b ɝː ɡ	Limburg
w ɛ b ɪ n ɑ ɹ	webinar
ɡ æ ɹ i	gharry
ɪ n e ɪ b ə l	inable
w ɪ t s ʌ n d e ɪ	Whitsunday
k ʌ l p ɹ ɪ t	culprit
p ɹ ɑ s ɛ s ɪ v ə t i	processivity
ɹ ɛ k ə n ɔ ɪ t ɚ	reconnoiter
j uː ʒ ə ɹ i	usury
ɡ ə n e ɪ ʃ ə	Ganesha
v ɛ ə ɹ i ə b l i	variably
m æ n ɪ k ɑ t i	manicotti
ɡ ɪ m l ə ɹ s	GMLRS
ɪ n d ɪ s k ɹ ɛ ʃ ə n	indiscretion
l ə m ɛ l ə	lamella
ə b i ə	abilla
ɹ ə k ɑː t s ɪ t ɛ l i	Rkatsiteli
k ɑ t͡ʃ ə t ɔ ɹ i	cacciatore
s ɪ ɹ ɪ n d͡ʒ i z	syringes
m ɑ d l̩	model
m ɑ n ə m ɚ	monomer
t ɔː s k e ɪ	Torske
p ɑ l ɪ m æ θ	polymath
æ n θ ɹ ə s a ɪ k l i n	anthracycline
s p ɔ ɪ l ɚ ɔ n	spoileron
d ə ɹ e ɪ ə l	derail
d j uː d ɛ t	dudette
b ɹ æ n w ɛ n	Branwen
k ɛ z ɪ k	Keswick
k ɹ æ p s	craps
t͡ʃ o ʊ k ɚ	choker
d͡ʒ æ m	jamb
æ p ə l z	apples
ɛ n v i ə b l̩	enviable
ɹ o ʊ m ə f o ʊ b i ə	Romaphobia
l æ ð ɚ	lather
k ʌ θ b ɜ ɹ t	Cuthbert
m ɑ l ə ɡ e ɪ d ə	malagueta
ɡ l u t o ʊ s	glutose
v ɛ d͡ʒ ə ʊ	veggo
d ɹ ɒ p m iː l	dropmeal
ɪ n d o ʊ l æ m iː n	indoleamine
d a ʊ t i	doughty
d͡ʒ ɪ n i	Ginny
s l ɪ k	slick
s k ɪ z m æ t ɪ k	schismatic
f iː s iː z	feces
d͡ʒ u s ɛ p ə t a ɪ t	giuseppettite
w o w k ə l	wokel
b ɔ ɪ z	boys
p æ ʃ ɪ z	pashes
s ʌ ŋ	sung
ɡ æ s t ɹ ə p ɑ d	gastropod
m ə z ɔː ɹ ɪ t	masoret
ə p ɹ e ɪ z ɚ	appraiser
p ɹ ə d ɪ k t ə b ɪ l ɪ t i	predictability
ə s t ɹ ɑ n ə m ɚ	astronomer
k l ɔ ɡ w ɪ n	clogwyn
æ z ɪ n o ʊ m a ɪ s ɪ n	azinomycin
s k a ɪ w ɔ k ə ɹ	skywalker
m a ɪ ə ʊ k a ɪ n	myokine
ɹ ɛ ɡ ə l	regle
h æ s t e ɪ t	hastate
b l ʌ d	blood
l ɛ v ɪ t i	levity
k i j o ʊ t o ʊ	Kyoto
p o ɹ k ɛ t ə	porchetta
ɹ i m o ʊ b ɪ l ɪ z e ɪ ʃ ə n	remobilization
h ɪ p n o ʊ s	Hypnos
k ʌ l t͡ʃ ɚ	culture
m u ɹ ə	mura
p ʊ s t ə	pusta
ɛ n z o ʊ	Enzo
ʍ ʌ t s	what's
h ɒ m ɪ l ɛ t ɪ k ə l	homiletical
f ʌ z ə l	fuzzle
v ɑ t n ɪ k	vatnik
s ə m n æ m b j ə l e ɪ t	somnambulate
h ɛ l m ə t	helmet
k ɛ ɹ s	carse
ɡ uː l	ghoul
v ɪ n d ɪ k ə b l̩	vindicable
f j uː ɡ ə s i	fugacy
k æ p t	capped
b l ʌ n t s	blunts
ɡ ɒ θ ə m a ɪ t	Gothamite
z ɑ ɹ	tsar
v ɚ s ɪ t	verset
p ɔ ɹ t ə b l̩	portable
s k ʌ d	scud
ɡ ɹ e ɪ p s k ɪ n	grapeskin
t ɛ t i	tetty
b ɑ ɹ n s t ə b ə l	Barnstable
d ɪ b ʌ ŋ k s	debunks
h ɒ t ʃ ɒ t	hotshot
t ɹ ɪ ʃ ə	Trisha
ə ɹ a ɪ	awry
d uː ɑ ɹ k i	duarchy
k l ʌ k s	clucks
p ɑ p ə ɹ ɑ t s i	paparazzi
ɔ ɹ θ ə d ɑ k s	orthodox
w a ɪ t w e ɪ	Whiteway
b a ɪ f ɛ ə ɹ i ə s	bifarious
k o ʊ ɑ p ə ɹ e ɪ ʃ ə n	cooperation
ɑ v i ə s	obvious
w ə ʊ l ɒ f	Wolof
k ɔː f t ə	kofta
t ɪ k ə l i	tickly
v ə l ɛ n s i ə	Valencia
ɔ t o ʊ ɛ θ n ə ɡ ɹ æ f ɪ k	autoethnographic
f ɛ s t ɪ v ə s	Festivus
ə ʍ ɜː ɹ l	awhirl
l ɔ ɡ	log
k ɹ æ ʃ ɪ z	crashes
n ɛ k t ə ɹ iː n	nectarine
m ɪ s s uː t	missuit
ɡ ɹ a ɪ p	gripe
ɑ p ə ɹ æ n d	operand
l ɪ m ə ɹ ɪ k	limerick
f ɹ uː ɡ æ l ə t i	frugality
ə t ɹ ɒ s ɪ t i	atrocity
t ɹ æ v ɪ s t i	travesty
d e ɪ ə t i	deity
ɹ ɛ m d iː z ɪ v ɪ ə ɹ	remdesivir
æ b s ɪ n θ	absinthe
ɡ ɹ ɛ ʃ ə m	Gresham
b ɪ n t	ben't
p ɹ ɑ s ɛ s ɚ	processor
k a ʊ ə b ʌ ŋ ɡ ə	cowabunga
ɡ ə d b a ɪ	goodbye
s t a ɪ l ʃ iː t	stylesheet
s ɛ f ə m æ n s i	psephomancy
b iː b iː k j uː	BBQ
ɡ ɔ ɹ d͡ʒ	gorg
w a ɪ θ	wythe
w ɛ l ɪ k	Welwick
k o ʊ v e ɪ l ə n t	covalent
ʌ m b r i ə l	Umbriel
ɪ f ɔː ɹ s	efforce
f ɚ ɡ ɛ t	forget
t ɹ a ɪ ɛ n t iː n	trientine
b ʊ ʃ ɪ ŋ	bushing
f ə n ɑ l ə d͡ʒ ɪ s t	phonologist
s l æ v ɚ	slaver
ɹ ə p ɔ ɹ t ɪ d͡ʒ	rapportage
m ɑ b	mob
s ɛ v ə n θ	seventh
m æ ɡ n ə m	magnum
ɛ ɹ ə t iː s ɪ s	erotesis
s e ɪ b a ɪ n	Sabine
s ɝ p l ʌ s ɪ z	surpluses
t u b ɚ	tuber
ɛ s t ə m e ɪ ʃ ə n	estimation
j uː b iː ə n	Euboean
t ɑ m ə s ɪ n	Thomasin
ʊ ɹ uː ʃ i ɔ l	urushiol
b ə t uː n	batoon
ɪ n j uː ɪ t	Inuit
ɹ i ə l a ɪ z ə b l̩	realizable
w ɒ k ə	waka
æ b ɪ ɹ ɪ t e ɪ t ɪ v	abirritative
æ d j ʊ l ə t ɔ ɹ i	adulatory
ə z e ɪ l j ə	Azalea
ə p ɹ iː s i e ɪ t	appreciate
m a ɪ k i	Mikey
e ɪ l ʊ ɹ ə f o ʊ b i ə	ailurophobia
b u t	boot
p ɹ ɑ d	Prod
ɡ l ɪ m ɚ	glimmer
s n ɛ l i	snelly
s t ə t ɪ s ɪ t i	staticity
o ʊ v ə ɹ d u	overdue
k ə n t æ m ɪ n e ɪ t	contaminate
b ɛ n s ɪ ɹ ə z a ɪ d	benserazide
l uː b ɹ ɪ k e ɪ ʃ ə n	lubrication
b ɹ æ k l i	Brackley
s k w ɪ ʃ i n ə s	squishiness
f ɹ ɛ t f ə l i	fretfully
m ʌ ð ə ɹ f ʌ k ɪ ŋ	motherfucking
ɪ ɹ ɪ d ɛ n t ɪ s t	Irredentist
w iː v ɪ l	weevil
d a ɪ iː n	diene
n ɪ p ə ɹ	nipper
k ə n t a m ɪ n ə n t	contaminant
p iː s f ə l	peaceful
ə ɹ ɡ ɑ t	ergot
æ l b e ɪ n i ə n	Albanian
v ɪ k t ɪ m	victim
ɡ a ʊ ɹ i	Gauri
ə ɡ l e ɪ	agley
v æ l ə m	vallum
m e ɪ	May
ɔː d ɹ i	Audrey
f ɹ æ t͡ʃ	fratch
l ɪ ŋ ɡ w ɪ s t ɪ k s	linguistics
m æ k ɹ ɒ n	Macron
w i l	we'll
p æ t ɹ ɪ s a ɪ d	patricide
ɡ ə ɹ o ʊ p ɪ z ə m	goropism
ɡ e ɪ z	gays
l ɛ t o ʊ v ɪ t s a ɪ t	letovicite
k æ s t æ l ə d͡ʒ ɪ n	castalagin
d ɑː m ə n ə t	dominate
a ɪ s o ʊ ɡ ɹ ɪ v	isogriv
e ɪ s iː ə m e ɪ	ACMA
æ s ɪ p ə t ɹ ə l	accipitral
t æ l ə ʊ	tallow
k ə n v ɑ l v	convolve
m ɛ s t iː z o ʊ	mestizo
n u m ə n	Newman
k l ʌ m p	clump
m æ s t	massed
k ɹ ɪ n d͡ʒ d	cringed
h o ʊ l l ə s	holeless
ɔː t o ʊ d a ɪ d æ k t	autodidact
k æ ɹ ə k ɔ ɹ ə m	Karakoram
v ə p o ʊ t ə s	VPOTUS
p ɛ ɹ ə s æ ŋ	parasang
æ k æ n θ o ʊ d i a ɪ	Acanthodei
f æ b	fab
f ɛ ɹ w e ɪ	fareway
ɛ θ m ɔ ɪ d	ethmoid
ɡ ɹ iː n ɪ ŋ z	greenings
s o ʊ ʃ	sosh
k æ p ɪ t æ n	capitan
b o ʊ l d	bold
æ n t ə	anta
t w ɪ t͡ʃ ɪ ŋ	twitching
l e ɪ n ɪ s	lenis
ɡ ə d e ɪ	g'day
d͡ʒ a ɪ n ə k ɑ l ə d͡ʒ i	gynecology
w ɪ t͡ʃ s o ʊ ɛ ɹ	whichsoe'er
b l ɪ m p s	blimps
k ə v iː t͡ʃ	caveach
h o ʊ l s t ə ɹ	holster
d ɛ n m ɑ ɹ k	Denmark
ɹ uː θ l ə s l i	ruthlessly
k o ʊ h iː ʒ ə n	cohesion
ə n ɑ m ə l ə s	anomalous
ɡ a ɪ n ɑ ɹ k i	gynarchy
d ɑː n w e ɪ	danwei
w ɪ n t ɚ	winter
ɪ n v ɛ n t	invent
k ɛ ɹ ə t ə ʊ f a ɪ t	keratophyte
t ɹ ə l ɔː n i	Trelawney
ɹ o ʊ	roe
f e ɪ k ə s t a ɪ n	Fakestine
p ɔː l a ɪ n	Pauline
ɛ k s k ə v e ɪ t ɚ	excavator
s k ɪ m ə l t ə n	skimelton
b ɝ k	berk
d ɪ s k ɹ ɛ d ɪ t	discredit
m ɒ l ɪ n j uː	Molyneux
ə b ʌ z	abuzz
p ɹ ə k j ʊ ɹ	procure
ə b z ɑ l v ə b l̩	absolvable
ɑ f ɪ ŋ	offing
ɛ v ə d ə n t	evident
ɒ l t ɹ ɪ ŋ ə m	Altrincham
h a ɪ l iː ɵ s ɔ ɹ ə s	Hylaeosaurus
d ə m ə l s ə n t	demulcent
s ɛ n t ə n ɛ ɹ i ə n	centenarian
s t ɛ ə ɹ	Stare
h ɑː d͡ʒ	hajj
b ʊ n d	bund
k e ɚ ə k æ l	caracal
f l ʌ ʃ ɪ z	flushes
s t ɹ ə ʊ p w ɒ f ə l	stroopwafel
b ɛ l i p o ʊ t ɛ n t	bellipotent
s ɑ v ə ɹ ə n t i	sovereignty
d͡ʒ ɔ ŋ ʃ ɑ n	Zhongshan
p ɹ ɛ ʃ i ɑ s ə t i	preciosity
s t ɒ l p ə ɹ s t a ɪ n	stolperstein
f ɹ uː t ɛ s ə n s	frutescence
ɡ æ ɹ ə m	garum
f ɪ l ə t æ k s ɪ s	phyllotaxis
ɡ æ m ə ɹ uː ʃ	gamaroosh
ɡ ɛ s t ə m ə t	guesstimate
ɑ s k ɚ	oscar
j ɑ t m ʊ l	Iatmul
ɪ n f l u ə n s ə ɹ	influencer
n j u ɹ ɒ l ə d͡ʒ i	neurology
k ɪ n e ɪ z	kinase
s l ə ʊ p i	slopy
d͡ʒ ə d ɛ k	Jedek
k w ɑ z i m o ʊ̯ d o ʊ̯	Quasimodo
ɹ ɪ f j uː z ɪ ŋ	refusing
z u ɑ l ə d͡ʒ i	zoology
ɪ ɡ j ʊ v a ɪ n	Iguvine
æ l o ʊ h ɪ s t ə ɹ i	allohistory
j ɑ ŋ d͡ʒ o ʊ	Yangzhou
k w ɪ p i	quippy
ɪ m b ɹ ɪ k e ɪ t ɪ d	imbricated
j uː ʒ ə ɹ ɛ s ɪ z	usuresses
t͡ʃ ɪ m b l i	chimbley
ɛ m ə d ɛ p s a ɪ d	emodepside
k ɛ t s ə l	quetzal
ɑ m b i ɑ n s	ambiance
d͡ʒ ʌ ŋ k ɪ t	juncate
m æ n t ə n iː ə	Mantineia
s ɛ m i ɑ t ɪ k s	semiotics
d ɚ n j e ɪ	dernier
s p ɛ d	sped
æ b s ə s ə n	abscisin
s k ʌ z i	scuzzy
l ɔ ɪ n	loin
t ɛ k n ɒ p ə l i	technopoly
ɑ k t ə p ə s	octopus
v iː t ə ʊ d	vetoed
t ɛ k s t ɪ d	texted
ɡ ɹ e ɪ	Gray
ɹ o ʊ z e ɪ ʃ i ə	rosacea
æ b s ə l j u t ə z e ɪ ʃ n̩	absolutization
w e ɪ d͡ʒ m ə n	Wageman
l ɛ p ə ɹ ə n	leporine
t͡ʃ ɛ k ɪ ŋ	checking
m ɑ ɹ k l æ n d ɪ k	Marklandic
ɛ k s j u m	exhume
ɹ i æ k ʃ ɪ n ɛ ɚ i	reactionary
k ɝ z i	kersey
ɡ j u l z	gules
m ɪ s t ɛ l ə	mistella
ɝ t͡ʃ ɪ n	urchin
ə b ʌ t s	abuts
p a ʊ d ɚ z	powders
ɹ ɛ d ɪ ŋ ɡ ə ʊ t	redingote
ɪ n s t ə ɡ e ɪ t	instigate
p sːː t	psst
k ɹ æ m p ɑ n	crampon
s p u n ʊ l ə	spoonula
t ɑ d͡ʒ i n	tajine
t ɑ d͡ʒ ɚ	todger
s t ʌ b ɚ n	stubborn
ɹ e ɪ z	rays
d ɪ n ə	dinna
m o ʊ d	mode
w ɪ ɡ ə ɹ i	wiggery
ɹ ɛ ɡ l ɪ t	reglet
h æ k n i	hackney
b ʊ k ɪ ŋ	booking
ɑ m ə n d z	almonds
d a ɪ ɹ ɛ k t l i	directly
f o ʊ k w e ɪ	folkway
t w i z	tweeze
s o ʊ p ə ɹ ɪ f ɪ k	soporific
ʃ ɑː s	chasse
m æ n d ɔː ɹ l ə	mandorla
t ɪ ŋ k ɚ ɪ ŋ	tinkering
m ɛ ɹ i ɒ n ɛ θ ʃ ə ɹ	Merionethshire
v ə k e ɪ ʃ ə n ə ɹ	vacationer
p ɒ s t͡ʃ ə m ə s	posthumous
k ɒ m ɪ n e ɪ t	comminate
θ a ʊ	thou
t ɑ p o ʊ a ɪ s ɑ m ə ɹ e ɪ s	topoisomerase
ʌ n n ɜː v ɪ ŋ l ɪ	unnervingly
h ɑ l i	Holle
ɛ l ə k æ m p e ɪ n	elecampane
d ɪ z i z	disease
f o ʊ ɡ i	fogey
p ɹ iː t ə ɹ m ɪ t ɪ d	pretermitted
t͡ʃ ʊ ɹ ɑː s k ə ʊ	churrasco
f ɛ l o ʊ	fellow
ɛ k s t æ n t	extant
s k ɪ ŋ k	skink
s iː l ɚ	sealer
s ɑː ɹ d	sard
d͡ʒ ɪ m n e ɪ z i ə m	gymnasium
k iː s a ɪ d	quayside
p ɪ ɹ i ə t	periodt
v ɪ z ɪ t ɪ d	visited
d͡ʒ a ɪ v d	jived
i d͡ʒ ɛ k ʃ ə n	ejection
p ə l æ ɹ ɪ t i	polarity
w ɛ k s f ə ɹ d	Wexford
d ɪ p s t ɪ k	dipstick
d ɪ s ɪ n f ɛ k t ə n t	disinfectant
ɡ ə l ɒ ʃ	galosh
m ɪ ɹ æ n d a ɪ z	Mirandize
t ɹ æ m p ə l iː n	trampoline
b ɔ ɪ ŋ ɡ iː	boingy
d ɛ l i	deli
æ s p ɪ s	aspis
f ɹ æ n s w ɑ	François
s m ɑ f	SMOF
v æ l ə n z j u ɛ l ə	Valenzuela
ə m iː d ə	Amidah
p ɹ ɪ n s ɪ p ə l	principle
w ɪ s k i	whisky
s k iː m	Scheme
ɹ ə f u l m ɑ n	refoulement
t a ɪ m p iː s	timepiece
v ɪ ə ɹ ə ʊ b ɔː ɹ d	Veroboard
s o ʊ d ə	soda
w ʊ l f i ə n	Wolffian
t͡ʃ ɪ f t͡ʃ æ f	chiffchaff
ə w ə ʊ k ə n	awoken
p ɔː ɹ t ə ɹ	portoir
ɛ v z ə ʊ n	evzone
k o ʊ ɪ n s ə d ə n t	coincident
k w ɛ n t͡ʃ ɪ ŋ	quenching
ɹ ɑ d ə m ɑ n t e ɪ d	rodomontade
ɪː k ɒ n ɒ m iː z	œconomies
t a ɪ f ə s	typhus
h æ m t ɹ æ m ɪ k	Hamtramck
k o ʊ b æ l ə m ɪ n	cobalamin
j ɑ ɹ l	yarl
m ə k e ɪ k ə ʊ	macaco
p ɚ k ʌ ʃ ə n	percussion
t ɹ ə p iː z i ə m	trapezium
f e ɪ l æ ŋ k s	phalanx
f a ɪ s ə s t ɪ ɡ m i n	physostigmine
f ʊ t s ɑ k	voetsek
ɡ ɹ æ n d ɪ s ə n ə n t	grandisonant
s t ɜ r d i	sturdy
p ɛ s ə ɹ i	pessary
s ɛ n s ɪ b ɪ l ɪ t i	sensibility
p w ɪ s ə n t	puissant
p ɑ n e ɪ d	panéed
θ i l ɑ ɹ k i	thelarche
s æ k j ə l ə s	sacculus
ɡ l ɑ t ə ɡ ɒ n ɪ k	glottogonic
t a ɪ l ə n d	Thailand
m u n w ɔ k	moonwalk
k æ l ə m n i	calumny
k æ n d l̩ l a ɪ t	candlelight
b ɹ uː t ə l ʌ ɪ z	brutalise
p ɝ s n ə l	personal
l ɔː n s	launce
b æ s ɪ n ɛ t	bascinet
ɔː n ɹ i	awnry
f ɪ t ɚ	fitter
k ə n s ɪ d ɹ ə b l i	considerably
l i ɡ ə l i z	legalese
b i l a ɪ	belie
ə ʊ v ə ɹ n a ɪ t	overnight
f ɑː m ə ɡ uː s t ə	Famagusta
b ɪ h uː v	behoove
l ə t ɪ b j ʊ l ə	latibulum
ʌ m b ɹ ɪ f ə ɹ ə s	umbriferous
t ɹ e ɪ d͡ʒ ə n	Trajan
f l uː k i	flukey
d ɪ ɹ ə ʒ i s t	dirigiste
s iː s ɪ s	CSIS
p ɹ iː d ə l	predal
ɪ f ɛ k t͡ʃ uː ə l i	effectually
ɹ æ ŋ ɡ ə l	wrangle
p ʊ l k i	pulque
k ɒ t͡ʃ ɪ m iː l i o ʊ	Coccimiglio
ʃ iː i	Shi'i
b a ʊ t s ə n	Bautzen
d͡ʒ ɪ n d͡ʒ u	Jinzhu
m ɪ s k ɹ i ə n t	miscreant
t i k ə n	TCON
l ʌ s t ə	lustre
ɪ ɹ æ d ɪ k e ɪ t	irradicate
f ɜː ɹ k	firk
s t ʌ m b l ɪ ŋ	stumbling
h a ʊ s	house
θ ɝ m o ʊ s t æ t	thermostat
p æ m i	Pammy
j ʊ n a ɪ t	unite
l ɔ ɹ e ɪ ʃ ə s	lauraceous
v ɛ n ɪ s	Venice
d ɪ m ɑ ɹ k e ɪ t	demarcate
k ə n t ɪ n j uː z	continues
b ɑː ɹ b ə ɹ a ɪ z	barbarize
m ɛ n s t ɹ e ɪ ʃ ə n	menstruation
iː d e ɪ	idée
v ə ɹ ɡ j ʊ l ə	virgula
ɒ k t e ɪ v e ɪ t	octavate
s t ɹ uː d ə l	strudel
h ʌ l ɪ ŋ	hulling
p i ɔ n	pwn
ɑ b d ʊ l	Abdul
d ɑː m ɪ n ɪ ɹ	domineer
d ɔː ɹ	dor
w a ɪ l d ə n	wilden
a ɪ s ɪ k	ISIC
k ə m p l iː t ɪ ŋ	completing
k æ l s ɪ n ə ʊ s ɪ s	calcinosis
ɔ ɹ ɡ ə n ɪ z e ɪ ʃ ə n	organization
ɑ b ɹ ə ʃ	abrash
m ɛ ɹ ə t ɹ ɪ ʃ ə s	meretricious
f l ɛ k s ɪ z	flexes
k ɑ k s ə	coxa
o ʊ m o ʊ k l ə v ɪ k j ə l ɚ	omoclavicular
z ɪ l j ə n θ s	zillionths
ɹ ɛ t ɹ ɪ b j u ʃ ə n	retribution
b a ŋ	bhang
m ə ɹ e ɪ d͡ʒ ɪ ŋ	maraging
ə k ɹ ɛ d ɪ t ɪ ŋ	accrediting
h æ n d i w ɝ k	handiwork
k ə n s iː v d	conceived
m ɑ h ɑ ɹ ɑː d͡ʒ ə	maharaja
s l iː p ɪ ŋ	sleeping
m u n ʃ i	munshi
ɪ p s ə p a ɪ ɹ ə ʊ n	ipsapirone
l iː o ʊ	Leo
p j ʊ b ɛ s ə n t	pubescent
s a ʊ θ s a ɪ d	southside
s uː p ə ɹ s ɛ n s ə t ɪ v ə t iː	supersensitivity
ə s j uː m	assume
ɪ n ə k s ɛ s ɪ b l̩	inaccessible
ʃ ɛ v ɹ ə	chèvre
h i m ə ɡ l o ʊ b ɪ n ɑ p ə θ i	haemoglobinopathy
w ɔ ɹ ɪ k	Warwick
n e ɪ z ə l i	nasally
ɡ æ d͡ʒ i	gadgie
n ɑ n d͡ʒ ɪ ŋ	Nanjing
m ɑ ɹ ɪ t o ʊ t s o ʊ	maritozzo
z ə ʊ ɪ k	zoic
k ɒ ɹ ə s k e ɪ ʃ ə n	coruscation
s a ɪ	xi
f ɔ ɹ ɪ n t	forint
ʒ ə ʒ uː n	jejune
l o ʊ p ɛ t	loppet
m ə l ʌ k ə z	Moluccas
ɔ n s ɛ t	onset
v ə ɹ d ɜ̃	Verdun
k ə m ɛ ʒ ə ɹ	commeasure
w ɑː z	Oise
n e ɪ s e ɪ l ɪ s	nasalis
p ɹ ɪ s	priss
f l ɛ k ʃ ə w ə s	flexuous
ɪ n ɛ ɹ ə n s i	inerrancy
s k ɛ n d	skenned
n e ɪ t͡ʃ ə ɹ ɪ s t	naturist
t͡ʃ e ɪ n z	chains
l ɑ t ɚ i	lottery
j u h i m ə ɹ ɪ z ə m	euhemerism
p ɹ ɛ d ɪ k e ɪ t	predicate
p ɒ l	poll
s æ ŋ k ʃ ə n	sanction
m ɛ ɹ ɪ ɡ o ʊ l d	marigold
s iː t	see't
s e ɪ ɹ ə	Sarah
k ə m p iː t s	competes
h a ɪ d ɹ e ɪ t	hydrate
b e ɪ s t ɚ z	basters
l æ s t s	lasts
t͡ʃ ʊ k ə z	chookas
m ɪ θ ɪ k ə l	mythical
æ ŋ ɡ ɔː ɹ ə	angora
t a ɪ p	type
p a ɪ θ ɑ n z	pythons
k w ɑː	qua
t a ɪ n	Tyne
z i n o ʊ p ɛ ɹ ə k ɑ ɹ d i ə m	xenopericardium
t ɪ ŋ k ɚ	tinker
s p ɛ ɹ o ʊ	sparrow
o ʊ v ɚ ɹ ɪ d ə n	overridden
ɪ n t ə ɡ ɹ ə l	integral
b ɹ æ k ɪ s ɛ f ə l ɪ k	brachycephalic
n ɑ ɹ w ə l	narwhal
b ɹ ɛ d m e ɪ k ɚ	breadmaker
t u m	tomb
ʌ n d ə t a ɪ̯ m	undertime
s o ʊ d i ə m	sodium
f o ɹ t u ɪ t ɪ s	fortuitous
ʌ n t e ɪ n t ɪ d	untainted
ɪ l i ɪ z ə m	illeism
b ə t iː s t	batiste
ɪ ɡ æ l ɪ t i	egality
k w ɑ n d ə ɹ i	quandary
b ʌ s	buss
d ɑː ʃ ɒ r ɒ t ɒ	Dasharatha
o ʊ d͡ʒ ə r ɒ n	Orgeron
ɹ æ t	rat
m a ɪ s ɛ l	micelle
t ɛ ɹ ɪ ə n	pterion
k ə ɹ ɪ b d ɪ s	Charybdis
d iː k ə n	deacon
m æ s t ɔ ɪ d	mastoid
b ɪ k	bikh
ɹ ə ʊ ɹ a ɪ m ə	Roraima
s ə s ɛ p t ə b ɪ l ɪ t i	susceptibility
ɪ ŋ k j ʊ b ə s	incubus
k l ɔː z j ʊ ə ɹ	clausure
h a ɪ ə s a ɪ ə m i n	hyoscyamine
æ n t ɪ d o ʊ t	antidote
ɪ n t u m ɛ s ə n t	intumescent
p ʌ m p i	pumpy
ə ʊ v ə n t	ovant
b ɑ ɹ l o ʊ	Barlow
p j ɝ ɪ t ə n	puritan
m o ʊ t ɪ v z	motives
l ɪ v	Liv
a ɪ s ɑ m ə ɹ a ɪ z	isomerize
f iː d ɪ ŋ	feeding
p l iː z	pleas
d æ d u	Dadu
s p u n ɚ	Spooner
p a ʊ d ɚ d	powdered
s k a ɪ ɡ l o ʊ	skyglow
ɑ f ə ɹ t ɔ ɹ i	offertory
t͡ʃ ɛ k ə s l o ʊ v æ k i ə	Czechoslovakia
m ɛ l i e ɪ ɡ ɹ a ɪ n	meleagrine
ɔː k	awk
h j ɝ ɑ n	Huron
d ɔ ɪ ŋ k	doink
m ɑ s k	mosque
b j uː t	butte
p ɹ ɪ v e ɪ ʃ ə n	privation
ɹ ɪ m ɛ m b ə ɹ ɪ ŋ	remembering
d ʌ d l i	Dudley
k ɹ e ɪ o ʊ l	Creole
d͡ʒ ɛ ɹ m i	Jeremy
p ɛ t j ʊ l ə n t	petulant
n a ɪ æ s ə l ə n d	Nyasaland
t ɹ æ n z l e ɪ ʃ ə n ə l	translational
t e ɪ z ɪ z	tases
s uː b ɹ ə s ə ʊ	soubresaut
f ɑː v n ə ɹ	Fafnir
k j uː n ɛ t	cunette
k æ t ə l a ɪ z	catalyze
f l ɔ ɹ ə n s	Florence
ɪ k s æ ŋ ɡ w ə n e ɪ t	exsanguinate
s l iː t	sleet
ɪ n d ʌ l d͡ʒ	indulge
b iː t s	beats
ɹ ɑ m b ɪ k o ʊ s i d o ʊ d ɛ k ə h i d ɹ ə	rhombicosidodecahedra
v ɪ ɹ æ d͡ʒ ɪ n ə s	viraginous
m e ɪ z ə n ɛ t	maisonette
s æ l o ʊ	sallow
l æ s t ɪ d	lasted
æ b z ɔ ɹ b ɪ d l i	absorbedly
æ l b a ɪ n o ʊ	albino
ɪ n d͡ʒ ɛ m ɪ n e ɪ ʃ ə n	ingemination
æ m ə ɹ ʃ ə m	Amersham
s t ʌ d i	study
k ɒ m f ɪ t	comfit
ɛ f l ə ɹ ɛ s	effloresce
h ɛ k s ə l ɪ ŋ ɡ w ə l	hexalingual
ʃ m ɛ k s i	shmexy
t͡ʃ ʌ n ə	chana
n ɑ v ə l ɪ s t	novelist
ɪ m ɪ ɡ ɹ e ɪ ʃ ə n	immigration
ɔ n b o ɹ d	onboard
θ ɛ ɹ ə p j u t ɪ k	therapeutic
l a ɪ b ɹ e ɪ ʃ ə n	libration
t ʊ ə ɹ d ɛ t ɑ n i	Turdetani
l ɪ n i ə ɹ ɪ ð m ɪ k	linearithmic
s t ɹ ʌ k t͡ʃ ɚ	structure
n iː ɡ ɹ ɪ s	Negress
p ɒ n t ɹ ʌ d ə v ɛ n	Pontrhydyfen
ð ɛ ɚ t uː	thereto
ɑ ɹ t ɪ k j ə l e ɪ ʃ ə n	articulation
d ɪ t e ɪ l z	details
k ɜː ɹ n ə h ə n	Kernahan
b ɹ ɪ t ə n i	Brittany
v ɪ t uː p ɚ ə t ɪ v	vituperative
s f ɪ ŋ k t ɚ	sphincter
ə f ɛ ɹ ə s ɪ s	apheresis
h iː l ɪ ŋ z	healings
m ə l ɑ n ʒ	melange
k ɑ ɹ n ə l	carnal
w ɑ n d ɚ w ɔ ɹ t	Wanderwort
l iː p t	leaped
h ɒ v ə l	hovel
d ʒ ɔ ɪ n t͡ʃ ə ɹ	jointure
m ʌ ð ə ɹ l a ɪ n	motherline
ɹ ɪ p ɹ a ɪ z	reprise
k ɒ l ɔ ɪ d	colloid
d ɹ ʌ m l i	drumly
e ɪ d ə n t	aidant
v ə l ɪ ʃ ə n t	volitient
p æ l ɪ d	pallid
h ə l uː s ɪ n e ɪ ʃ ə n	hallucination
k ɪ b ɪ t s	kibitz
b ʊ ə ʒ w ɑː	bourgeois
ɡ o ʊ m ɛ z	Gomez
θ a ʊ z ə n d t θ	thousandth
ð ɛ ɚ	their
k ɹ iː m i	creamy
n ə s ɛ s ɪ t j uː d	necessitude
m æ l iː ə b ə l	malleable
ə b ɑ m ɪ n e ɪ ʃ i o ʊ	abominatio
s ɪ ŋ ɡ ə l p l e ɪ ə ɹ	singleplayer
ɹ i ə l a ɪ z d	realised
ɑ ɹ k e ɪ d i ə n	Arcadian
d o ʊ z	does
b æ k t ɪ ɹ i ə	bacteria
t ɛ n d ɚ n ɪ s	tenderness
b ɛ s ɪ l ɛ s ə m æ b	besilesomab
p a ʊ t͡ʃ	pouch
a b ɪ ɡ e ɪ l	abigail
p ɹ ə d ʌ k t ɪ v	productive
ɪ n v əː t ɪ b r ə t	invertebrate
d a ɪ ə f ə ɹ iː s ɪ s	diaphoresis
s a ɪ z k o ʊ d	sizecode
t ɔː ɹ p ə ɹ ɪ f ɪ k	torporific
ɛ k s t ɪ ɹ i ɚ ɪ z e ɪ ʃ ə n	exteriorization
p ɚ v ɚ t	pervert
k ɹ u ɪ t	cruet
b l a ɪ n d l i	blindly
j æ ə	yea
k æ t ə ɡ ɒ ɹ ɪ ə l i	categorially
s m ɑ ɹ m i	smarmy
d͡ʒ ʌ t s	juts
w ɪ n d b ɜː ɹ n	windburn
h ɪ t m æː n	hitman
l ɑː k s	lakhs
h o ʊ p m æ k s	hopemaxx
æ b ə ɹ ɪ d͡ʒ n̩ ə l i	aboriginally
k ɝ i ɚ	courier
e ɪ k ɚ	acre
ɹ ɪ f ɝ d	referred
d ɔ ŋ ɡ æ ŋ	Donggang
ʃ ɪ k ɔ ɡ o ʊ	Chicago
l ɑː f iː ɛ t	Lafayette
ɪ n	in
iː k w ɪ æ ŋ ɡ ə l d	equiangled
ɑ k j ʊ l ɚ	ocular
p ɹ i s a ɪ s ɪ v	precisive
æ n t ɪ ɡ o ʊ	Antigo
ɡ ɹ æ f ɪ k s	graphics
v ə d͡ʒ a ɪ n ɔ ɪ d	vaginoid
s o ʊ n ə ɹ ə s	sonorous
s e ɪ p i ə n t	sapient
æ b s k w ɑ t͡ʃ ʊ l e ɪ t	absquatulate
f uː k j ɛ n	Fukien
æ n d ɪ s a ɪ t	andesite
t ɹ ə p ɒ l ə d͡ʒ a ɪ z	tropologize
ə b æ n d ə n	abandon
h ɑ n d j ʊ ɹ ə s	Honduras
æ d l u m ɪ n ə l	adluminal
ɡ æ l ə n t l i	gallantly
s l a ɪ ð i	slithy
s p ɪ n ɪ ŋ	spinning
s t ɔ ɹ i	story
k e ɪ s	case
t ɹ æ n s f ə ɹ ə n s	transference
h e ɪ l a ɪ d	halide
n ɔː t͡ʃ	nautch
ɪ n h j uː m e ɪ n	inhumane
t w ɪ d ə l i	twiddly
s ʌ b d ʌ k t	subduct
p ɒ t i	potty
w a ɪ z	wise
w ɔ t ɚ ʃ ɛ d	watershed
t ɹ ɪ ɡ ə m i	trigamy
ɛ ɡ z o ɹ b ə t ə n t	exorbitant
d ɛ s ə k ɹ e ɪ̯ t	desecrate
b l æ b d	blabbed
t r ə n ɛ n t	Tranent
h ɒ ɡ ə ɹ i	hoggery
m ɑ n ʃ ɛ t	manchette
ʌ n p ɑː ɹ t͡ʃ t	unparched
j uː θ s	youths
d͡ʒ iː b ə s	Jeebus
ə b uː d͡ʒ ə	Abuja
m ɪ s t ə ɹ	Mister
æ k s ɛ l ə ɹ e ɪ t ɪ v	accelerative
a ɪ d o ʊ s	idose
k ɒ n f ɛ k t	confect
p ɚ d ɝ ɪ ŋ	perduring
f ɔː l iː z	forlese
k ɑ l ə m n ɪ s t	columnist
ɪ n ə k ɑ n ə m i	ineconomy
n ɪ b	nib
ɹ ɪ f ə l	riffle
ɹ ə t æ n	rattan
p a ʊ d ə ɹ i	powdery
p ɪ k l ɪ ŋ	pickling
k w ɔː t ə b a k	quarterback
n j uː b	newb
p ɔ ɹ t ɹ ə t	portrait
t ɹ æ ŋ k w ɪ l a ɪ z	tranquilize
n ɝ s ɹ i	nursery
h a ɪ d ɹ ɑː d͡ʒ ɪ ɹ ɒ n	hydrargyron
k l ɪ ŋ ɑ n	Klingon
s æ t ɪ s f æ k t ə ɹ i	satisfactory
b ə θ e ɪ n ə k ɔ l	bethanechol
ɪ ŋ ɡ	crackalackin'
b ɹ ɪ ʒ ʊ ə ɹ	brisure
ʍ ɪ s k ə ɹ	whisker
p ɑ n t͡ʃ o ʊ	poncho
k ʊ r ʊ x	Kurukh
w ɪ ð ə ɹ l ɪ ŋ	witherling
h ə b ɪ t͡ʃ w ə l	habitual
k ə l ɪ k j ə l ə s	calyculus
d e ɪ t ə ɹ i	datary
v o ʊ l t ɛ ɹ	Voltaire
f ɹ æ n s ɪ s k ə ʊ	Francisco
u b ə ɹ l i	uberly
m ʌ ɡ ɪ n z	muggins
l ɑ h ɑ ɹ	lahar
iː z i	easie
æ k ɹ ə f o ʊ b	acrophobe
ɡ ʌ t ə ɹ ə l	guttural
d ɑ d͡ʒ o ʊ	Dazhou
ʃ ɪ p ɹ ɛ k i	shipwrecky
d ɑ k j ə m ə n t s	documents
l u a ʊ	luau
f j u k s ɪ n	fuchsine
w ʌ n s ɚ	oncer
p æ ɹ ə ɡ ɹ æ f	paragraph
ɑ n t ɹ ə p ɹ ə n ʊ ɚ	entrepreneur
d a ɪ s i	dicey
ɛ n w e ɪ v	NWAV
s t ɛ n s ə l	stencil
m æ ɹ i o ʊ	Mario
æ ŋ ɡ z a ɪ ə t i	anxiety
æ b s ɔ ɹ b ɪ ŋ l i	absorbingly
s ʌ d n̩ l i	suddenly
m ɪ ŋ	ming
b ə r iː ə	Berea
s ɪ t ə d ɛ l	citadel
ɑ t l ɑ t l̩ ɪ s t	atlatlist
d ɹ a ɪ	dry
k w ɛ s t͡ʃ ə n ɪ ŋ	questioning
ɑ n d æ n s ə t ɹ ɑ n	ondansetron
p ɪ n t ə t uː k	Pentateuch
k ə l ɛ s t ə ɹ ɒ l	cholesterol
ɪ n j u ɛ n d ə ʊ	innuendo
d ɛ m ə n s t ɹ ə b l̩	demonstrable
f æ k t ʃ u ə l	factual
p j uː æ l ə p	Puyallup
p ɛ ɹ ə m ɔ ɹ f ɪ k	paramorphic
w e ɪ ɪ ŋ	weighing
d iː f e ɪ s	deface
s i t ə k o ʊ s ɪ s	psittacosis
d ɪ s p l e ɪ ɪ ŋ	displaying
ɪ ŋ ɡ ɹ iː v	engrieve
w ʊ d n̩ t	wouldn't
s t a ɪ l ɔ ɪ d	styloid
s ə ɹ v a ɪ l	servile
b ɑ k s ɪ z	boxes
k a ɪ l i	Kylie
ɪ n k ə m ɛ n t s ə ɹ ə b ə l	incommensurable
ɡ ɹ o ʊ z	grows
h o ʊ m ɒ ɡ l ɪ f i	homoglyphy
k ə ɹ æ ŋ ɡ ə m a ɪ t	Corangamite
ə ʊ v ə ɹ k ɒ n f ɪ d ə n t	overconfident
h ɑ ɹ θ	hearth
d ɪ v a ɪ z ɪ z	Devizes
ɡ ɹ ɑ ɡ i	groggy
ɡ ɹ e ɪ t ɪ d	grated
p ɛ t k ɒ v	Petkov
b a ɪ ɹ ɪ f ɹ ɪ n d͡ʒ ə n s	birefringence
h ɑː l ə f ɝː n iː z	Holofernes
f ɪ l ɪ k ɔ ɪ d	filicoid
ɛ ə ɹ i ə ʊ p ə d͡ʒ ɪ t ɪ k	Areopagitic
æ k t iː ɒ n	Actaeon
t æ m p ə n e ɪ d	tamponade
ɪ n iː d͡ʒ ə	inedia
f a ɪ l	phial
ʃ ɑ p ə	schappe
ɡ æ n d ʒ	ganj
p ɹ ɛ k s i	prexy
l ɑ k s t ɪ t͡ʃ	lockstitch
