æ f t ə ɹ ə f ɛ k t	aftereffect
k æ n d ɪ d ə t͡ʃ ʊ ɚ	candidature
d ɪ v ɛ l	divel
a ɪ l ə	Isla
l a ɪ s ɪ l	lysyl
k w ɔ ɹ t ə ɹ i	quartary
ɪ p ɑ k s i	epoxy
ɑ m ə ɹ o ʊ n e ɪ	Amarone
h ɪ k ʌ p	hiccup
ɡ ɹ ə ʊ n ə ɹ	groaner
ɪ n t ə l ɛ k t͡ʃ w ə l	intellectual
s u d o ʊ h iː m ə f iː l i ə	pseudohemophilia
ɛ n e ɪ b ə l m ə n t	enablement
k a ɹ iː b o ʊ ɫ iː	Khariboli
ʃ l ə m ɑː z ə l	schlimazel
m iː t i ə ɹ ɑ l ə d͡ʒ i	meteorology
k ə n v e ɪ ɚ	conveyor
p iː k s	peaks
ʌ n d ə ɹ ɹ i æ k t	underreact
h ɛ l θ i ɚ	healthier
ʌ n m ʌ s t ə ɹ ə b ə l	unmusterable
ə p ɹ ɑ k s ɪ m ə t	approximate
ɹ i s k ɛ d͡ʒ ʊ l	reschedule
d a ɪ ə t ɹ i	dietary
t o ɹ t͡ʃ ɚ	torture
ɪ ð	i'th'
s k ɪ l z	skills
ɪ p ɪ s t ə m ɑ l ə d͡ʒ i	epistemology
b ɪ d ə f ɚ d	Biddeford
s t æ t	stat
ɑ k s f ɚ d	oxford
k a ɪ z ə n	kaizen
m æ l ə d æ p t ə b ə l	maladaptable
ɡ l ɪ s ə ɹ a ɪ d	glyceride
t ə s w e ɪ d͡ʒ	tasswage
m ə n iː ʃ ə s	monoecious
ɡ ɛ t ə	goetta
ə ʊ n ə ʊ s ɛ k ə n d	ohnosecond
s æ d͡ʒ ɪ t ə ɹ i	sagittary
k ʌ m ə θ	cometh
ɪ n k ə l ɛ s ə n t	incalescent
ɹ iː s ɪ l æ b ɪ f ɪ k e ɪ ʃ ə n	resyllabification
n ɑ k t ɝ n ə l	nocturnal
k uː ɪ ŋ z	cooings
ʃ ɪ ŋ ɑː n	Xing'an
d ɹ ɛ ɡ z	dregs
f l ə v ɛ s ə n t	flavescent
f a ʊ l ə ɹ	fowler
t ɔ ŋ l ɪ ŋ	Tongling
s w æ ɡ	swag
p ɹ ɪ f ɝ d	preferred
w ɑ ʃ ɚ	washer
k i l o ʊ z	kilos
æ k s ə d ə n s	accidence
k æ b ɪ d͡ʒ ɪ z	cabbages
æ k æ n θ ɑ l ə s ɪ s	acantholysis
k l æ v ə s a ɪ θ ɪ ə ɹ i ə m s	clavicytheriums
æ p ə z ɪ t	apposite
d ʌ k b ɝ ɡ ɚ	duckburger
f e ɪ ɪ z ə m	phaeism
l ɪ m ə z ɪ n	Limousin
o ɹ ɪ n o ʊ k o ʊ	Orinoco
k ɹ iː d z	creeds
p j ʊ ə ɹ ə l ə n t	purulent
b ɑ ɹ b e ɪ d i ə n	Barbadian
ə ʊ d ə l ə s	odorless
f ɛ ɹ ə l	Farrell
d͡ʒ ɛ n ə ɹ ɑ s ə t i	generosity
k ʌ z ə n	cozen
æ n t a ɪ k ə l o ʊ n i ə l	anticolonial
b ɹ æ ɡ z	brags
f ɔ ɫ s ɛ t o ʊ	falsetto
p j ʊ ɹ	pure
n j u ɹ ɑ n	neuron
k ɝ t	curt
l ɛ f t i	lefty
b ɪ z n ɪ s ɪ z	businesses
j uː	eugh
ɹ ɪ b ɪ t	ribbit
k æ m p	camp
b ɝ n i	Bernie
ʃ ɛ ə ɹ ə n ʃ n ɪ t ə	scherenschnitte
s ɒ l s t ɪ ʃ ə l	solstitial
h iː θ	Heath
ə d͡ʒ ʌ s t	adjust
w ʊ d h ɛ n	woodhen
p ə l a ɪ t	polite
t ʌ k s	tux
b ɹ æ k ɪ e ɪ t	brachiate
d͡ʒ ɛ n i	Genny
æ s ɪ t æ b j uː l ɪ f ə ɹ ʊ s	acetabuliferous
d ɪ k ɹ ɛ p ɪ t l i	decrepitly
s ə s t e ɪ n ə b ə l	sustainable
iː v æ l	eval
s ɛ p ʃ ə w ə d͡ʒ ɪ n t l	Septuagintal
ə l u ʒ ə n	allusion
v ɛ s t ə l	vestal
ɪ k s t ɹ iː m ɪ s t	extremist
s uː p ə l æ l i	soopolallie
w ɪ t b i	Whitby
s t iː l j ɚ d	steelyard
e ɪ d͡ʒ ɚ	ager
m ɪ k s ə m ə t ə ʊ s ɪ s	myxomatosis
æ m ɛ ɹ ɪ k ə n a ɪ z d	Americanised
s a ɪ ə n s ɪ z	sciences
s ə l ɛ k t ɪ v	selective
f ə s ɪ l ɪ t i z	facilities
n e ɪ t o ʊ ɹ ɑ s e ɪ	netorase
m o ʊ a ɪ	moai
f l ʌ s t ə ɹ ɪ ŋ	flustering
ʃ ɛ l t ɹ ə n	sheltron
h i l i ɑ l ə t ɹ i	heliolatry
s ɪ ŋ k t	synced
ɛ p ɪ d ɛ m i ɑ l ə d͡ʒ i	epidemiology
h a ɪ p ə t ɹ o ʊ k ɔ ɪ d	hypotrochoid
m ɪ k ɒ l a ɪ ɪ v k ə	Mykolaivka
ɪ m o ʊ ʃ ə n z	emotions
b æ k s t ɚ	Baxter
s ɑ f ə n ə r	softener
s t ɹ e ɪ t d͡ʒ æ k ɪ t ɪ ŋ	straitjacketing
b ɪ b l ɪ k ə l	biblical
ɑ ɹ n a ʊ t	Arnaut
ʒ ɪ v ɑː ɹ	Zhivar
s iː k ə n d	secund
h ə ɹ æ s	harass
m ʌ d s l ʌ m	mudslum
b æ ɹ i æ t ɹ ɪ k	bariatric
ɪ n s t ɪ t uː ʃ ə n	institution
s v ɛ l t	svelte
d͡ʒ ə w ɑː n	jawan
t ə n o ʊ ə n	Tanoan
k ɔ ɹ ə n ɚ	coroner
t ɹ ɑː n s f ɔː ɹ m ɪ s t ɪ k	transformistic
h a ɪ p æ l d͡ʒ ɪ l k	hypalgic
f a ɪ n	fine
p n ɪ k s	Pnyx
k j uː b ə n e ɪ t ɪ s	Kubernetes
æ d m ɪ t e ɪ t ə ɹ	admittatur
s ɝ ə ɡ ɪ t	surrogate
t ɹ uː l i	truly
j ʌ p s	yups
v æ l ə d ɪ k t ɹ i	valedictory
p ɹ ə ʊ p e ɪ n d a ɪ n a ɪ t ɹ a ɪ l	propanedinitrile
m ɑ n ɚ k	monarch
p ə r æ f r ə s ɪ s	paraphrasis
m ɔː ɹ d ə k a ɪ̯	Mordecai
k ɹ ʌ m b l̩ ɪ ŋ	crumbling
s t ɹ a ɪ d ɪ ŋ	striding
b æ k ə n e ɪ l i ə n	Bacchanalian
k ɛ z	Kez
ɹ iː z ə n ə b ə l n ə s	reasonableness
ʃ ɛ l t ɚ	shelter
ə θ æ m b i ə	athambia
f ɔ ɹ m o ʊ z ə	Formosa
p ə l ɛ m ɪ k s	polemics
f l u ɪ d ɪ k	fluidic
ə l iː v i e ɪ ʃ ə n	alleviation
w ʌ ɹ i d	worried
ɹ ɪ t ɒ ɹ ɪ k	rhetoric
j e ɹ ə v ɑː n i ə n z	Yerevanians
s θ ɛ n ə l æ ɡ n i ə	sthenolagnia
l uː v ə ɹ	Louvre
k ə ɹ ʌ p ʃ ə n	corruption
k l o ʊ p ɛ n θ ɪ k s ɔ l	clopenthixol
m j uː k o ʊ p l æ s t i	mucoplasty
ʃ ɹ ʌ ɡ d	shrugged
s ɪ m ə l ɚ l i	similarly
l ɔː ɹ ʌ ʃ ə	Laurussia
f ɛ n s	fence
w ə b æ n ə	Wabana
m æ l ə d i	malady
m uː	moue
s l iː p l ə s	sleepless
w ɑ p	whop
l ɛ p t ə ɹ a ɪ n	leptorrhine
ɔː k l ə n d	Auckland
ɡ ʌ t ɪ ŋ z	guttings
f ɚ m ə t i	frumenty
h ɔ ɹ ɚ s ə m	horrorsome
t ɹ ɪ n ɪ d æ d iː ə n	Trinidadian
w e ɪ d	wayed
ɡ l e ɪ z	glaze
æ ð ə l ɪ ŋ	atheling
j ɔ ɹ	your
h ʌ n t͡ʃ	hunch
d ə ʊ t ɪ ʃ	dotish
k ɑ o ʊ ɑ e ɪ n	ǂKxʼauǁʼein
k æ l s ɪ d	chalcid
æ d v ɚ t a ɪ z m ə n t	advertisement
f ɪ k t ə ɹ	fictor
k æ s t	cast
ɡ æ l ə	gala
ʌ n b ɹ ɛ d	unbred
ɪ n t ɛ n ʃ ə n ə l	intentional
æ l ɪ ɡ z ɑ n d ɹ ə	Alexondra
v a ɪ s ɹ iː d͡ʒ ə n t s i	viceregency
m ʌ l t i l ɪ ŋ ɡ w ə l	multilingual
s æ t ɪ s f a ɪ	satisfy
ə k æ n t θ ə s ɛ f ə l ɪ d	acanthocephalid
ʌ m b ɹ ə l	umbral
m ɜː ɹ m ə ɹ ə s	murmurous
s t ɹ iː t l ə t	streetlet
k l æ v j ə l ə n e ɪ t	clavulanate
s ə l ɛ b ɹ ɪ t i	celebrity
s æ ŋ ə	sanga
t͡ʃ ʌ m p i ɚ	chumpier
k ə n d ɪ m	condemn
ɑ ɹ t l ɪ s	artless
ɑ b d ʊ l ɑ	Abdullah
k æ n ə b ə l	cannable
k ʌ d l̩	cuddle
p ɛ ɡ d	pegged
p æ n d ə n	pandan
h a ɪ ɡ ɹ ɔː l ɪ k	hygraulic
s i n ɵ z o ʊ ɪ k	Cenozoic
s ə p o ʊ z d	supposed
f ɔː k l ə n d z	Falklands
ʌ n d ɚ	under
ə m ɛ ɹ ɪ k ə z	Americas
ɛ l v ə n	elven
t ɛ n ə n s i	tenancy
p ɪ t͡ʃ ɚ	pitcher
p ɛ d ɪ k ə l	pedicle
ɔː t ə l ɪ t ɪ k	autolytic
d ɪ f ɚ m ə n t	deferment
s t ɪ m j ə l ə s	stimulus
p ʌ l j ʊ l e ɪ ʃ ə n	pullulation
j ɑ ŋ k ɚ z	Yonkers
m æ m ɪ f ə ɹ ə s	mammiferous
æ ɹ ə m	Arram
ɪ b iː s ə	Ibiza
ɪ n t͡ʃ æ n t ɚ	enchanter
k ɔ ɹ ɪ n θ	Corinth
ə k a ʊ n t	account
ɪ n f a ɪ ə ɹ	enfire
m æ s k l ə s	maskless
d ɹ ɪ ŋ k ɚ	drinker
v ɛ d͡ʒ t ə b ə l z	vegetables
k ɑ n l e ɪ ŋ	conlang
p æ n t s	pants
f r iː p ɔ ɹ t	Freeport
ɪ n ʃ ɪ t ɪ f ɪ k e ɪ ʃ ə n	enshittification
ə n f l a ɪ t i	unflighty
ɛ l d ɚ l i	elderly
v ɛ t ə v ɚ	vetiver
ɪ m p ɔ ɹ t uː n ɪ t i	importunity
m i s o ʊ	miso
ɹ a ʊ n d	round
ʃ e ɪ n	Shane
v ə t uː	vattoo
ɑ ɹ ə ɹ i	orrery
k ə θ ɑ ɹ s ɪ s	catharsis
m ʌ n d e ɪ	Monday
ʊ k ə p ɪ ɹ m ə s	Occopirmus
p ɹ ɪ v e ɪ d ə ʊ	privado
b æ k t ɪ ə ɹ ɪ ɒ s k ə p i	bacterioscopy
f ɪ d	fid
w ɛ z l ɪ ə n ɪ z ə m	Wesleyanism
iː d͡ʒ ɛ s t͡ʃ ə n	egestion
ʃ u b ɪ l	shoebill
d͡ʒ ɛ f e ɪ l	jeofail
s ɪ h ə j u æ n	siheyuan
t ɹ ə ʊ k ɪ l ɪ k	trochilic
æ b ə t ə s ə z	abatises
ɪ ɹ ʌ p t	erupt
s o ʊ t͡ʃ i	Sochi
s t ʌ b i	stubby
k ɔː k æ s ɪ t i	Caucasity
j u s ɜ ɹ p ə ɹ	usurper
k ɒ z m ɒ l ə t ɹ i	cosmolatry
ɡ l ɛ n m ɔː ɹ	Glenmore
v ɪ d æ ɹ ə b i n	vidarabine
b æ d ʒ ɚ	Badger
k ɹ ɪ p t o ʊ z o ʊ ɑ l ə d͡ʒ i	cryptozoology
k ɔː ʃ ə s	cautious
f ʊ l v ɛ s t ɹ ə n t	fulvestrant
ɛ k s t ɹ ə t ɛ ɹ ɪ t ɔ ɹ i æ l ɪ t i	extraterritoriality
æ m b ɪ d ɛ k s t ɹ ə s	ambidextrous
p ɪ m p ɪ ŋ	pimping
s t ɹ o ʊ̯ k ɪ ŋ	stroking
m ʌ z l ɪ n	muslin
f ɹ a ʊ	frow
ɪ l ɛ ŋ k ə s	elenchus
m ɔ ɹ ɪ ʃ	Moorish
s ɝ k ə d a ɪ ə n	circadian
ɪ m ɪ z ə ɹ a ɪ z e ɪ ʃ ə n	immiserization
j uː p ɪ k	Yup'ik
b ɝ s ɪ f ɔ ɹ m	bursiform
s t ə b ɪ l ɪ m ə n t	stabiliment
t ɝ n ɪ p	turnip
ɡ ʌ n	gun
ɪ n t͡ʃ æ n t	enchant
s ə b m ɝ d͡ʒ	submerge
t͡ʃ ɑ k	chaulk
l æ d ɪ t uː d ə n ɛ ɹ i ə n ɪ z ə m	latitudinarianism
p ɹ ə ʊ f æ m	propham
d e ɪ m z	dames
t ɹ æ f ɪ k s	traffics
ɪ ŋ ɡ ə t	ingot
k a ʊ ɚ d	coward
d a ɪ ɹ ɛ p ʃ ə n	direption
p ɹ ə ɹ ɑ ɡ ə t ɪ v	prerogative
t ʌ l w ɑ ɹ	tulwar
s æ n t ə n ɪ n	santonin
ə m ɛ ɹ ə k ə n ə s	Americanness
p ɹ ɪ s k ɹ ɪ p t ɪ v	prescriptive
d͡ʒ iː p	geep
s ʌ f ə r e ɪ ʃ ə n	sufferation
æ n t ɪ k w ɪ t iː z	antiquities
b ə m b ɑ ɹ d	bombard
s ɪ l ə k	sillock
k u m i	khoomei
æ k ɹ ə ʊ p ɒ s θ ɪ ə n	akroposthion
f e ɪ θ s	faiths
b ɛ l ɪ ŋ z	bellings
b ə s ɑ l t	basalt
s iː l i æ k	celiac
ɑː s m ɑː t	arsesmart
ɑ m	alm
ə b ɪ t͡ʃ ə w ɛ ɹ i	obituary
w e ɪ z ɡ uː s	wayzgoose
ɡ ɪ l d	guild
k l ɛ ə ɹ i	clary
b ɹ æ m l ə d ɛ ʃ	Bramladesh
ɛ v ɪ d ə n t͡ʃ ə l	evidential
d ɛ ŋ f ɛ ŋ	Dengfeng
f ɹ a ɪ ʔ n̩ d	frightened
d ɛ ɹ i ɛ ə ɹ	derrière
k ə n s ɜː ɹ v	conserve
d͡ʒ ɛ m ɪ n a ɪ ə n	Geminian
v ɪ d͡ʒ ɛ s ɪ m ə l	vigesimal
p ɛ n t ə ɡ ɹ æ m	pentagram
f æ n f ɛ ɹ	fanfare
ɪ m p ɛ ɹ ɪ ʃ t	emperished
p ɹ o ʊ t ɪ ə n	protean
v ɛ t ɚ	vetter
ɹ ɛ z ə ɹ v w ɑ ɹ	reservoir
t͡ʃ iː f s	chiefs
n ɪ t ɪ d	knitted
ɹ ɛ p l ə k e ɪ s ɪ z	replicases
ɪ ɹ ʌ p t ɪ v	eruptive
ʃ æ s ɝ	chasseur
f ɑ k i ɹ	fakir
m ʌ m p s ɪ m ə s	mumpsimus
k ɔ ɹ i o ʊ d͡ʒ ɛ n ə s ɪ s	choriogenesis
e ɪ k ɑ m	AACOM
b a ʊ n s ɪ z	bounces
w ɪ n d ɪ ŋ	winding
æ s t ɹ ɑ n ə m i	astronomy
k ɑ ɹ d ɪ f	Cardiff
ɡ ʌ n ʃ ɪ p	gunship
ɹ æ p s ə d i	rhapsody
w iː k ɪ v ɜː ɹ s ə ɹ i	weekiversary
s ɛ f ə l ɪ n	cephalin
k ɑ n s l̩ t e ɪ ʃ ə n	consultation
æ n t ɪ ɹ iː ɒ n	Antirrion
j ɛ m ə n	Yemen
ɡ ɹ æ n d s t æ n d	grandstand
æ k s ə s ɔ ɹ i ə l	accessorial
ɹ ɛ t ɹ o ʊ æ k t ɪ v	retroactive
v ɪ d i ə ʊ f a ɪ l	videophile
p l ʌ n d ɚ	plunder
m ɝ s i ə	Mercia
k a ʊ n t ə ɹ t a ɪ m	countertime
s t ɹ ɪ ŋ z	strings
p ɹ ɛ z b ɪ t ɪ ɹ i ə n	Presbyterian
m ɑ l i k ɑ d ə l	mollycoddle
p ɔ ɪ n t l ə s l i	pointlessly
t͡ʃ ʌ n d ɹ ə b ɪ n d uː	candrabindu
s ɪ n ə b ɑː ɹ	cinnabar
k ɪ n ɪ k ə n ɪ k	kinnikinnick
æ s t ɹ ə n ɑ m ɪ k ə l	astronomical
k o ʊ t ɪ ŋ z	coatings
h e ɪ t s	hates
s æ k ʊ ɹ ə	sakura
a ʊ ɚ	our
s æ l v z	salves
k ə p æ s ɪ t i	capacity
b u l i ə n	Boolean
j uː k s ɪ n ɪ k	euxinic
b ɔː d	baud
w ɪ ð ɚ	wither
s æ n ɪ t͡ʃ	Saanich
ɑ k s k ɑ ɹ b æ z ə p i n	oxcarbazepine
h ɛ s a ɪ t	hessite
k o ʊ t ɪ d	coated
d͡ʒ u d e ɪ̯ ɪ k ə	Judaica
n uː t ɹ ɪ ʃ ə s	nutritious
h w ɛ l v ɑ	Huelva
l ɛ d	LED
æ b s t ɝ s ɪ v	abstersive
ɑ k w ə t ɛ k t͡ʃ ɚ	aquatecture
f ɔː ɹ ʃ æ d o ʊ	foreshadow
ɹ uː θ iː n i ə	Ruthenia
ɹ a ɪ z ɪ ŋ	rising
m ɪ s f i l d	misfield
m ɛ n d e ɪ ʃ ə s l i	mendaciously
uː s ɪ k	oosik
b ɪ w ɪ l d ə ɹ m ə n t	bewilderment
v ɪ k t ɹ o ʊ l ə	Victrola
d ə ɹ e ɪ t͡ʃ o ʊ	derecho
z ə n ɑː n ə	zenana
θ ə ʊ n	thone
n æ k s	knacks
s t e ɪ ð z	Staithes
ɹ æ v ɪ n	ravine
b l æ n d	bland
ɪ ɡ n e ɪ ʃ ə s	Ignatius
ɹ ɪ s t ɹ ɪ k t ɪ v	restrictive
ɡ æ l ɪ v æ n t	gallivant
ʌ n k ɔ ɪ f	uncoif
l æ n t ə l uː	lanterloo
ɡ i j ə m e ɪ z	guillemets
k ə t͡ʃ ɑ p i	kecapi
s ɪ n t͡ʃ ɪ ŋ	cinching
d ɪ m j ɔ ɹ	demure
ʊ l s t ɚ	Ulster
p ə t i	petit
k ə l ʌ m n ɚ	columnar
b ɑ ɹ k ɪ ŋ	barking
t ɑ ɹ t uː f	tartuffe
f ɔː ɹ ɑː ɹ l b ɜː ɹ ɡ	Vorarlberg
l æ m b æ s t	lambaste
l o ʊ ɡ ɑ s	logos
d͡ʒ ɪ n ɑ n	Jin'an
t uː n	Toon
b u l i m i ə	bulimia
n e ɪ ɡ ʊ ŋ	neigong
d o ʊ d͡ʒ o ʊ	dojo
k ə n e ɪ d i ə n z	Canadiens
ʃ o ʊ ɪ ŋ	showing
ɔː s t ɚ	auster
b i ɡ ɛ t	beget
s ɛ l e u k ə s	Seleucus
s k ɹ ʌ n t	scrunt
ə k ɝ	occur
t͡ʃ ɪ ɹ f ə l i	cheerfully
w ɪ ŋ l	wingle
ɑ ɹ ɡ ə t	argot
e ɪ n ʌ ð ɚ	another
s iː ɡ ʌ l	seagull
ə b j ʊ ɹ ə	abura
d ɪ ə ɹ n ə s	dearness
ə b e ɪ z ə n s	abaisance
f j uː m z	fumes
k ʌ l ɚ	color
v ɝ t ɪ ɡ o ʊ	vertigo
b ʌ d i	buddy
ɪ z	is
æ n ɪ m u	animu
k j ʊ ɹ i ə s ɚ	curiouser
ʌ p s ɔː ɹ	upsoar
m ɑ ɹ ʃ m ɛ l o ʊ	marshmallow
b ɔ s t ə n	Boston
p ə t ɛ l	Patel
t ɹ a ɪ d͡ʒ ɛ m ə n a ɪ	trigemini
ɒ m n ɪ p ɝ f ɪ k t	omniperfect
d͡ʒ i ɪ k	geic
z a ɪ ɹ ɪ d	xyrid
f ɛ ɹ i l æ n d	Ferryland
s p ɑ ɹ k	spark
t uː t	Tut
t ɑ k ə n ɑ w ə	Takanawa
m a ɪ ɔː l	myall
m ə k f ɜː ɹ s ə n	McPherson
s f ɪ ɡ	sphyg
k ʊ ʃ æ ɡ	cushag
b ə ʊ l a ɪ k	bowlike
s ɚ k j uː ɪ t ə s	circuitous
æ l ɪ s k ɪ ɹ ə n	aliskiren
n ɑ n s ɛ n s	nonsense
ə s ɪ ɹ i ə	Assyria
m a ɪ n ɒ t	Minot
ɪ m ə d͡ʒ ɚ	imager
a ɪ b ə ʊ f ə ʊ b i ə	aibohphobia
j u p ɪ θ ɛ k i ə	Eupithecia
s iː m z	seems
b ɪ z m ɑ ɹ k	Bismarck
t s æ t l iː	tsatlee
h uː ɪ n	Huynh
t ɔ s	toss
n o ʊ z ə l	nosel
k uː m ə ɹ ɪ n	coumarin
ʌ n f ɛ n ɪ s t ɹ e ɪ t ɪ d	unfenestrated
d ʌ b ɪ ŋ z	dubbings
æ n h i d ɑ n ɪ k	anhedonic
d ɔ n t	daunt
b ɪ d a ɪ z ə n ɹ ɪ	bedizenry
æ ɡ o ʊ n	agon
ɛ l m	elm
θ æ ŋ k s ɡ ɪ v ɪ ŋ	thanksgiving
k ʌ v ə t ə s n ə s	covetousness
ʃ æ t o ʊ b ɹ i ɑ̃	chateaubriand
d͡ʒ uː d ɪ k ə b ə l	judicable
h a ɪ p ə ɹ k ɹ ɪ t ɪ k	hypercritic
k ɔ f ɚ	coffer
n i o ʊ p e ɪ t ɹ i ɑ ɹ k i	neopatriarchy
ɹ a ɪ	rye
n iː m ɔ ɪ	Nimoy
n ɛ ɡ l ɪ d͡ʒ ə n t	negligent
n ʌ p	nup
l e ɪ n t θ	length
b æ n d z	bands
s p l o ʊ d	'splode
k ɔ ʊ l z	Coles
f ɪ n f ʊ t	finfoot
d e ɪ b j uː d	debuted
ɪ n t ə s ə s ɛ p ʃ ə n	intussusception
f ɹ ɛ d i	Freddie
k ə m ɛ s t ə b l̩	comestible
ɹ ɛ p l ɪ k e ɪ t ɚ	replicator
ɡ ə l a k t ə ʊ z	galactose
h ɛ ɹ ə k l a ɪ t ə s	Heraclitus
t͡ʃ ɑ p s	chops
t ɹ ɪ m ɪ ŋ	trimming
m ɛ ɹ ə m ɪ k t ɪ k	meromictic
k o ʊ s a ɪ n	cosign
b ɑ ɹ d ɑ l ə t ɚ	bardolator
ə p ɛ n d ɪ k s	appendix
ɹ ɒ m z i	Romsey
ɹ ɒ k s b ə ɹ ə	Roxburgh
h ɪ l i	hilly
ə f o ɹ d	afford
d ɹ a ʊ z i	drowsy
b e ɪ ɡ ə m	begum
k ɔː ɹ n ɪ ʃ	corniche
p a ɪ k ə	pica
k ə n ɪ p ʃ ə n	conniption
ɑː ɹ θ ɹ ɪ t ɪ k	arthritic
p ɹ a ɪ e ɪ p ɪ k	priapic
f ʊ t	foot
æ m ɪ d	amide
ɡ ɒ n ə k ɔː ɹ ɪ s t ɪ k	gonochoristic
p ɑ ɹ t ɪ k j ə l ə t	particulate
j uː ə n ɪ m	euonym
p ɪ p	Pip
p æ ɹ ə l ɛ l ə p a ɪ p ɪ d	parallelepiped
l ɪ s t	list
ɛ p ɪ d͡ʒ a ɪ n	epigyne
ɹ æ n d i	randy
h ɑ m ə ɹ ʃ o ʊ l d	Hammarskjöld
k ə n t ɪ n j u ə s l i	continuously
n ə ʊ v e ɪ t	novate
s ɔ ɹ t i	sortie
ʊ ə ɹ ə ʒ a ɪ n ə j ə	Urozhaynoye
m a ɪ z	mise
p ɹ o ʊ v o ʊ	Provo
t æ n e ɪ t ʃ	tanh
p ɑ p ɚ	popper
b ɪ h ɛ d	behead
s k w ʊ ʃ	sqush
s ə ɹ k æ ʃ ə n	Circassian
s iː k ə m	caecum
k e ɪ k i	caky
p ɪ l ɡ ɹ ɪ m ɪ d͡ʒ	pilgrimage
d ɔ ɹ m ɚ	dormer
k ɑ n f l u ə n t	confluent
n j uː t ə n	Newton
n e ɪ n	Nain
p æ m	palm
j o ʊ x	yogh
ɛ l ɑː m	Elam
æ l u ɛ t	Alouette
t ɛ s	Tess
p ɝ p ə s l i	purposely
b ɑ ɹ k ɑː	Barqah
e ɪ b a ɪ ə l ɑ d͡ʒ ə k l̩	abiological
ə ʊ v ə ɹ f l ə ʊ t	overfloat
b e ɪ d ə n ɒ x	Badenoch
f o ʊ n ɪ ŋ	phoning
t ɛ t ɹ æ l ə d͡ʒ i	tetralogy
w ɛ s t b ɹ ʊ k	Westbrook
p ɑː p i ə m ɛ n t o ʊ	Papiamentu
h iː p s	heaps
f ɔ ɹ t ɛ l	foretell
d ɪ f θ ɪ ɹ i ə	diphtheria
m e ɪ t s	mates
s l e ɪ v i	Slavey
k o ʊ æ ɡ j ə l ə t ɔ ɹ i	coagulatory
t e ɪ m ɚ	tamer
p æ n ə ɹ æ m ə	panorama
v o ʊ k æ l ɪ k	vocalic
p ɔ s	pauce
ɪ n d͡ʒ ɛ s t	ingest
b ɹ æ ɡ ə d o ʊ ʃ i o ʊ	braggadocio
h o ʊ m l ə s	homeless
t ɔ ɹ	Tor
v iː k o ʊ	Vico
k ɹ æ b	crab
s ɛ n s e ɪ ʃ ə n	sensation
k ɑ ɹ v ɪ ŋ	carving
ɡ ɹ e ɪ d	grayed
ʍ ɪ ɾ ɪ k ə ˞	Whittaker
f ʌ n	fun
s ɪ f ɪ l ɪ s	syphilis
p ɹ ə s i d͡ʒ ɚ z	procedures
ɹ a ɪ n	Rhine
k ə n ɛ k t s	connects
s æ m p ə	SAMPA
ɹ ə v ɝ b ə ɹ e ɪ t ɪ v	reverberative
m e ɪ n t	mayn't
f ə ʊ b ɪ ə	phobia
ɪ k s p ɪ ɹ i ə n s t	experienced
ə l a ʊ ɪ ŋ	allowing
k æ ʒ	cas'
f j uː z i	fusee
k ɑ ɹ k ə s	carcass
b l ɪ s	Bliss
k ɔ ɹ p ə ɹ ə t	corporate
ɛ θ ə l b ɔ ɹ n	ethelborn
t ɛ m p iː	Tempe
t͡ʃ ɑ ɹ k o ʊ l	charcoal
t o k i	toqui
s ə b d u	subdue
k ɹ uː n ɪ ŋ z	croonings
ɡ e ɪ b i ə n	gabion
k ɹ i o ʊ l	creole
n ɪ f l i z	kniffles
l ɪ t	lit
v ɜː ɹ t s	verts
b æ ɹ ɪ s	baris
ɹ ɑ k l ɪ ŋ	rockling
m ʌ s k ə v i	Muscovy
m ɑ d͡ʒ ɔ ŋ	mahjong
k ʊ n s t k ɑ m ɚ	kunstkammer
ɛ ŋ ɡ ə l	engle
ɛ n k l o ʊ ð	enclothe
k ɑ s t j u m	costume
z ə ɹ i n ə	Zarina
æ p ɪ ɹ e ɪ z	apyrase
b ɹ ɪ s k ɪ t	brisket
d ɹ e ɪ p ɪ t	drapet
ɪ n f ɹ iː z	enfreeze
b uː m ə ɹ	boomer
m æ ɹ ə t	marrot
d ɛ k ə	deca
m a ɪ k ɹ o ʊ ɡ ə m i d ə f a ɪ t	microgametophyte
æ b s ə l j u ʃ n̩	absolution
m ɪ d s ɛ k ʃ ə n	midsection
h ɪ b	Hib
n ʌ l ɪ b ɪ k w ɪ t ə s	nullibiquitous
k o ʊ s a ɪ n	cosine
l ɑ k s m ɪ θ	locksmith
h æ n d ɪ ŋ	handing
l ɪ s t	Liszt
ɡ l æ s i	glassy
ɝ t͡ʃ ə n	urchin
d ɪ f	diff
b o ʊ s æ l	bozal
m i d i o ʊ k ə ɹ	mediocre
v ɛ s p ɚ t ɪ n	vespertine
ɹ e ɪ l ɪ ŋ	railing
ɡ ɪ n s uː	Ginsu
t̪ aː l i	tali
l a ɪ t l ɛ s	lightless
n ɪ k t ə l o ʊ p i ə	nyctalopia
k l ɝ k s	clerks
ɛ s ə n t	essent
ɪ n t ɛ n ə b ə l	intenible
ɹ æ f i ə	raffia
w ɪ ŋ k	wink
p ɹ o ʊ v ɛ k ʃ ə n	provection
k ə p ʊ t	kaput
z o ʊ ɹ o ʊ æ s t ɹ i ə n ɪ z ə m	Zoroastrianism
o ʊ p i s i j u	OPSEU
t uː l ə ʊ	tulou
p ɛ n ə t ɹ e ɪ l i ə	penetralia
h e ɪ t i	heiti
s ɑ d ə m	Sodom
t i ɑ ɹ ə	tiara
h ɛ t	het
k ɑ n d͡ʒ ə ɡ ə l	conjugal
n æ ɹ e ɪ t ɚ	narrator
o ʊ n a ɪ ɹ o ʊ m æ n t s i	oneiromancy
l ɑ n d͡ʒ ə t u d	longitude
k e ɪ p ɪ ŋ	caping
v l i	vlei
m æ d͡ʒ	madge
ɡ l æ s f ə l	glassful
ə b s ɔ ɹ b n̩ s i	absorbancy
ʃ ə m ɑː d	chamade
k ɒ n d͡ʒ ə ɹ e ɪ ʃ ə n	conjuration
m ɛ l ɪ ə s	melleous
p ʌ m p k ɪ n	pumpkin
ɡ ɑ l ɪ f ɪ k e ɪ ʃ ə n	gallification
b ɹ ɔ n	brawn
d ɑ ɡ m æ t ɪ k	dogmatic
o ʊ s ɪ n t	OSINT
n a ɪ l u t ə m a ɪ d	nilutamide
t æ s ɪ t ʊ s	Tacitus
m ɛ f ɪ s t ɒ f ɪ l iː z	Mephistopheles
k ɹ uː s ɪ f a ɪ	crucify
b æ n k w ɪ t ɚ	banqueter
ɪ n t ɹ ə m ɪ t	intromit
l e ɪ ə d ɪ s iː ə	Laodicea
m ɛ t ə s a ɪ k l i n	metacycline
d ɪ s s ɝ v ɪ s	disservice
l ʌ n t͡ʃ	lunch
d ɪ s k ə n t ɪ n j u	discontinue
l ɪ m ɪ t	limit
j u l ɪ θ i	Ulithi
p l æ ŋ k t ə n	plankton
k æ v ɹ ə n	cavern
ʃ iː ɑː t s uː	shiatsu
t͡ʃ i z l ə t	cheeselet
k ɹ ɪ p s ɪ s	crypsis
s uː p ə ɹ ə s æ s ɪ n	superassassin
s t ɹ ɛ ŋ k θ s	strengths
æ m b ɹ o ʊ z	Ambrose
l ɛ v ə l	level
t iː l ə ɹ i	telary
p ɹ ə t ɹ æ k t ə ɹ	protractor
ɪ m p l ɔ ɪ d	employed
m ɛ s ə l	mesyl
ʃ uː ɡ	zhoug
d ɪ m p ə l m ə n t	dimplement
f i t ə ɹ	fetor
s t e ɪ t s m ə n	statesmen
d ɪ s p j uː t	dispute
m ɛ n t ə l	mental
f ɔː ɹ m j uː l	formule
æ l i w e ɪ	alleyway
b ʌ ɡ d	bugged
k ɛ̃ t	quinte
æ l i ə m	allium
i f ɹ i ə m a ɪ t	Ephraimite
ɑ k t ə p ʊ s	octopus
v ə ɹ æ n d͡ʒ i ə n	Varangian
k l æ k s	clacks
f e ɪ k ə n	facon
k æ t ə ɹ	quatre
ɹ ɛ p ɹ ə z ɛ n t e ɪ ʃ ə n z	representations
ʌ n l ɪ s n ɪ ŋ	unlistening
v ə n ɪ l ə ɹ	vanillar
l e ɪ w ɑ ɹ d ə n	Leeuwarden
æ k æ n θ e ɪ ʃ ə s	acanthaceous
ɡ l ɑ b j ə l ɚ	globular
h ɛ t ə ɹ o ʊ s ɛ k ʃ u ə l	heterosexual
w uː ʃ	whoosh
ɹ a ʊ ɹ iː m uː	Raurimu
ʃ e ɪ	shea
k w ʌ s	quus
s ʌ b p ɹ a ɪ m	subprime
k ɹ ɪ ʃ n ə	Krishna
ɪ m o ʊ ʃ ə n ə l	emotional
ɛ s i	esse
f ɛ n p ɹ ɒ p ə ɹ ɛ k s	fenproporex
t͡ʃ æ p	chap
b ʌ p k ɪ s	bupkis
d ə l a ɪ t	delight
s t iː ə t ə ɹ iː ə	steatorrhea
t ʊ ɹ	tur
ɛ p ɪ f ɑ ɪ t	epiphyte
θ æ ɡ ə m a ɪ z ə ɹ	thagomizer
k l ɪ n t͡ʃ	clinch
k æ n ə b ɪ s	cannabis
ə p ɑ k ə l ɪ p s	apocalypse
k ɑ ɹ v ɪ l	carvel
p l æ n t	plant
k ə l uː d	collude
s t ɹ iː k i	streaky
ʍ uː z	who's
ə ʊ p ə n w ɜː ɹ k	openwork
ʌ m b ə l æ p	umbelap
f ɑ l i	folly
b e ɪ ə n ɪ̈ t	bayonet
d ɛ l	del
ɹ uː l ɛ t	roulette
m ə n ɪ l ə	manila
l ɪ m a n	Lyman
s ə p ɹ a ɪ z	surprise
d o ʊ f æ̃	dauphin
p l a ɪ ə s iː n	Pliocene
æ b æ k o ʊ	Abaco
ə s ɪ s t s	assists
d æ b d	dabbed
f ə b ʌ k s ə s t æ t	febuxostat
w ɛ t ə	weta
r iː ɪ d	rheid
t ɹ æ n z m ɪ s	transmiss
ə s t ɹ ɪ n d͡ʒ	astringe
p ə n æ ŋ	Penang
e ɪ b ɹ ə h æ m	Abraham
d͡ʒ ə h o ʊ v ɪ s t ɪ k	Jehovistic
ɹ ɪ ɡ ɹ ɛ ʃ ə n	regression
v ɪ l ə n ɛ l	villanelle
f a ɪ̯ ɚ w ɝ k s	fireworks
θ ɔ ɹ æ k s	thorax
ə b ɹ e ɪ d ɚ	abrader
æ b s o ɹ k i	Absarokee
o ʊ v ə ɹ ɹ i æ k t	overreact
s w ɔː ɹ ð	swarth
ɪ t æ l ɪ ʃ	Italish
m ɑ ɹ k ɪ d	markèd
ɛ s w ɑː t i n i	Eswatini
k o ʊ l a ɪ	coli
f ɹ æ ŋ k ə f o ʊ b i ə	Francophobia
b æ k s a ɪ d	backside
p ɔ ɪ z ɪ ŋ z	poisings
k ɛ t͡ʃ ə w ə	Quechua
e ɪ d͡ʒ f ʊ l	ageful
d a ɪ ə p ɔː z	diapause
æ b ə k ə s ɪ z	abacuses
k ə d ɪ j ɪ v k ə	Kadyivka
s o ʊ ʃ i o ʊ t o ʊ p	sociotope
iː k w ə l i	equally
ɛ f b iː a ɪ	FBI
s ə r t ə z	syrtis
ɡ ɹ ə n a ɪ k ə s	Granicus
f ɪ ɹ d	fyrd
k ɪ l i æ d	chiliad
æ f l u ɛ n z ɪ k	affluenzic
ɪ n t ɹ ə p ɹ ə n ʊ ɚ ʃ ɪ p	intrapreneurship
k ɑ t ɑ	khata
a ɪ ɹ e ɪ t	irate
ɛ k w a ɪ z ə n	equison
d ə m ɑː n	Daman
s ɪ m b ə l a ɪ z	symbolize
ɹ i p ɚ t ɪ b l̩	repertible
t ɛ ɹ ə t ɔ ɪ d	teratoid
ə m ɪ s ɪ ŋ	amissing
s ɛ k s t ɛ t	sextet
æ n t i	auntie
w ɜː k m ə n ʃ ɪ p	workmanship
f uː m ɑː ɹ t	foumart
ɛ d͡ʒ ə t e ɪ n m ə n t	edutainment
f ɝ n ɪ ʃ t	furnished
æ p ə l	apple
p ɹ ɒ m p t n ə s	promptness
ʌ n t æ k i	untacky
ɡ ɹ iː v ɪ ŋ z	grievings
l ə t i n ɛ k s	Latinx
æ ɡ j uː ʒ æ k	ageusiac
v ɜː ɹ p	vurp
m ʊ z l ɪ m ə z	Muslimas
k ə n ɪ f ə ɹ ə s	coniferous
d ɒ ŋ k	donk
s k a ɪ d	skied
ɒ l ɪ s	Ollis
p ʌ p ə t ɪ ə ɹ	puppeteer
f l ʌ t ɚ	flutter
s k ɪ z ə m ə d͡ʒ ɛ n ə s ə s	schismogenesis
ʌ n n æ t͡ʃ ə ɹ ə l	unnatural
f ɔ ɚ ɹ ə s t ə l	forestal
ə d j u	adieu
ɹ ɪ k ɜː ɹ s ɪ v	recursive
w ʌ n t s t	oncet
p l ʌ n d͡ʒ ɚ	plunger
ɪ m p ɹ ɑ b ə b ɪ l ɪ t i	improbability
s uː n æ k a ɪ t	Sunakite
d a ɪ ə n a ɪ s i ə	Dionysia
s t ʌ f t	stuffed
t o ʊ d s t u ə l	toadstool
p a ɪ θ ɑ n	Python
t͡ʃ ɑ ɹ ɡ ə ɡ ɑ ɡ ə ɡ ɑ ɡ m æ n t ʃ ɔ ɡ ɑ ɡ ɑ ɡ ɑ ɡ t͡ʃ ɔ b ə n ə ɡ ʌ ŋ ɡ ə m ɑ ɡ	Chargoggagoggmanchauggauggagoggchaubunagungamaugg
p l æ d i k ə ɹ d ɪ k	platykurtic
p æ l m ɚ iː n	Palmyrene
o ɹ k ə	orca
s a ɪ l ɪ d͡ʒ	silage
p ɪ k t	Pict
ɹ iː p ɑː ɹ s	reparse
v ə ʊ k ə l a ɪ z	vocalise
h i m ə ɡ l o ʊ b ɪ n	hemoglobin
ɹ ɛ s k j uː d	rescued
ə l ɪ m p i ə	Olympia
d͡ʒ ə s ɪ n d ə	Jacinda
s t o ʊ ɪ s ɪ z ə m	stoicism
k æ l d i ə	Chaldea
f l ɪ m z i	flimsy
ɪ n k ɑ n ɡ ɹ u ə s	incongruous
k l ɔ ɪ s t ɚ	cloister
p æ l ə t a ɪ z	palettize
b ɔ ɪ ŋ k	BOINC
h æ l ɪ k ɹ ɛ t	halecret
ɛ p ə f ə n ɑ m ə n ə	epiphenomenon
æ b s ɔ ɹ b ə f e ɪ ʃ n̩ t	absorbefacient
e ɪ b ɹ ə m m æ n	Abramman
m ʌ s k ə d iː n	muscadine
n uː n	noon
ɡ ɹ ʌ b ɪ ŋ	grubbing
s æ n d p e ɪ p ɚ	sandpaper
k w ə h ɑ ɡ	quahog
ə m	'm
s ɛ v ə ɹ ə l i	severally
ʌ n s t ɪ n t ɪ d	unstinted
p ɹ a ɪ m e ɪ t s	primates
ɡ ɹ a ʊ n d s ə l	groundsel
m ɔ ɹ p ɔ ə ɹ k	morepork
o ʊ k ɚ	ocher
m ə t æ k ɹ ə n ɪ z m	metachronism
l ɪ n w ʊ d	Linwood
ʃ ɑ t	chott
t ʃ ɑː ŋ i	Changi
n ɪ f t	nift
ɡ e ɪ n ɚ	gainer
d͡ʒ iː p	Jeep
v ɛ ɹ ɪ f a ɪ	verify
ʌ n ə ʃ e ɪ m ɪ d n ə s	unashamedness
k ɪ t	kit
b a ɪ o ʊ æ n ə l ɪ t ɪ k s	bioanalytics
æ d͡ʒ w a ɪ n	ajwain
ɹ o ʊ m ə n i	Romani
s l uː θ s	sleuths
a ɪ t æ n ɪ k	Itanic
h æ p ə l i	happily
s e ɪ ɑ n s	séance
m ə ʊ t ə ɹ k e ɪ d	motorcade
ɪ m p e ɪ ʃ ə n s	impatience
k ɑ n t ɹ ə l æ t ə ɹ ə l	contralateral
s ɛ m ə t ɛ ɹ i	cemetery
k ə n s t ɹ uː z	construes
t æ n ɹ uː	tanru
b ɹ æ k ɪ s ə f æ l ɪ k	brachycephalic
ə n t ɹ iː t i	entreaty
f ə ɹ b o ʊ t ə n	verboten
t e ɪ n t j ʊ ə ɹ	teinture
ə b ɝ s t	aburst
æ n d͡ʒ ə l iː n ə	Angelina
n e ɪ z o ʊ l æ k ɹ ə m ə l	nasolachrymal
k w ɝ n	quern
æ ɹ ə ʊ m a n t ɪ k	aromantic
ɹ ɪ z ɛ n t f ə l	resentful
ʃ æ t ə l e ɪ n	chatelain
s ɒ l f ɛ ʒ	solfège
s t ɪ l w ə l	Stillwell
ɪ ɡ z ɛ k j ʊ t ɹ i	executory
m ə t ɜː ɹ n ɪ t i	maternity
s ɑ t ə v ɑ h ə n ə	Satavahana
v ɛ ə ɹ k ɛ ə ɹ	varchar
ɪ ŋ k ɒ n t ɪ n ə n t	incontinent
ɹ iː d ɹ ʌ m	redrum
m e ɪ n s t e ɪ	mainstay
v ɪ s ɪ n ə l	vicinal
ɔ ɡ ɚ	augur
s t uː	stu
d͡ʒ i h o ʊ v ɪ s t ɪ k	Jehovistic
s ə b ɹ a ɪ ə t i	sobriety
f æ s iː z	fasces
f ɹ ɪ k l i	Frickley
p o ʊ d͡ʒ o ʊ	POJO
ɡ ɹ e ɪ z ɪ ŋ	grazing
v ɛ ɹ ə s ɪ m ə l ɚ	verisimilar
s t i m	steam
ɪ k s p ɹ ɛ s o ʊ	espresso
p ɪ ŋ k i	pinky
p ɒ z	poz
j u n i e ɪ t	Uniate
t æ n t ə ɹ ɑː	tantara
iː z	ees
k ə n s ɛ ʃ ə n	concession
k w ɛ s t͡ʃ ə n ɛ ɹ	questionnaire
h ɑ ɹ m l ə s l i	harmlessly
f uː d͡ʒ i ə n	Fujian
v ɛ ɹ i d	varied
s t ɔ ɹ z	stores
h æ n s ɚ d	Hansard
s e ɪ b ɚ	sabre
m ɑ m	mom
m ɪ s t e ɪ k s	mistakes
m æ l t o ʊ t	maletote
p ɹ ɑ k s ɪ n ɑ s	proxenos
t͡ʃ a ʊ ʃ	chiaus
ɡ ɪ m ɪ k i	gimmicky
ɹ ɪ d iː m	redeem
s ɛ n t ɛ n ə ɹ i	centenary
s ɑ ɹ d ɪ n i ə	Sardinia
